Detector,DateTime_local,Date_local,Time_local,Hour_local,auto_id,match_ratio,fc,sc,offset,margin,alternate_1,alternate_2,alternate_3,manual_id,n,pulses,dur,files,channel,fmax,fmin,duration,detector_id,source_file,folder,in_file,out_file_fs,out_file_zc,indir,outdir,matching,fmean,tbc,fk,tk,s1,tc,qual,review_orgid,DateTime_UTC
MCE,10/16/2025 19:04:10,2025-10-16,19:04:10,19,LASCIN,0.667,23.647,12.77,0,0.28492,NA,NA,NA,NA,6,6,11.612,1,0,25.868,21.991,9,24A04F085FDF19C0,Schmeeckle 2025 Master.csv,10 17\20251017,24A04F085FDF19C0_20251017_000410T.WAV,24A04F085FDF19C0_20251017_000410_000,NA,NA,MCE,4,23.821,584.871,24.043,5.315,70.102,7.007,1.83,NA,2025-10-17T00:04:10Z
MCE,10/16/2025 20:22:20,2025-10-16,20:22:20,20,LASCIN,0.429,24.77,10.66,0,0.144812,NA,NA,NA,NA,7,7,7.935,1,0,29.469,24.265,9,24A04F085FDF19C0,Schmeeckle 2025 Master.csv,10 17\20251017,24A04F085FDF19C0_20251017_012220T.WAV,24A04F085FDF19C0_20251017_012220_000,NA,NA,MCE,3,26.266,890.52,25.311,5.195,63.508,7.258,2.3,NA,2025-10-17T01:22:20Z
MCE,10/16/2025 20:22:34,2025-10-16,20:22:34,20,LASNOC,0.6,24.455,18.79,0,0.149056,NA,NA,NA,NA,10,10,5.661,1,0,27.22,24.069,9,24A04F085FDF19C0,Schmeeckle 2025 Master.csv,10 17\20251017,24A04F085FDF19C0_20251017_012234T.WAV,24A04F085FDF19C0_20251017_012234_000,NA,NA,MCE,6,25.43,338.887,25.736,2.227,55.53,5.039,2.23,NA,2025-10-17T01:22:34Z
MCE,10/16/2025 20:55:28,2025-10-16,20:55:28,20,LASCIN,0.278,24.211,10.59,0,0.108448,NA,NA,NA,NA,19,18,7.131,1,0,26.898,23.733,9,24A04F085FDF19C0,Schmeeckle 2025 Master.csv,10 17\20251017,24A04F085FDF19C0_20251017_015528T.WAV,24A04F085FDF19C0_20251017_015528_000,NA,NA,MCE,5,24.742,279.851,24.713,2.945,22.13,5.418,6.22,NA,2025-10-17T01:55:28Z
MCE,10/22/2025 21:21:36,2025-10-22,21:21:36,21,LASCIN,0.375,24.224,9.8,0,0.11776,NA,NA,NA,NA,9,8,5.236,1,0,25.517,23.83,9,24A04F085FDF19C0,Schmeeckle 2025 Master.csv,10 23\20251023,24A04F085FDF19C0_20251023_022136T.WAV,24A04F085FDF19C0_20251023_022136_000,NA,NA,MCE,3,24.544,774.457,24.622,2.265,31.291,4.145,2.09,NA,2025-10-23T02:21:36Z
MCE,10/23/2025 06:32:02,2025-10-23,06:32:02,6,LASBOR,0.6,30.922,4.21,0,0.059108,NA,NA,NA,NA,5,5,15.104,1,0,31.36,30.29,9,24A04F085FDF19C0,Schmeeckle 2025 Master.csv,10 23\20251023,24A04F085FDF19C0_20251023_113202T.WAV,24A04F085FDF19C0_20251023_113202_000,NA,NA,MCE,3,30.931,201.73,30.997,2.79,-5.5,8.312,3.2,NA,2025-10-23T11:32:02Z
LPO,10/23/2025 18:57:54,2025-10-23,18:57:54,18,LASCIN,0.5,23.846,23.52,0,0.155846,NA,NA,NA,NA,4,4,5.476,1,0,26.297,23.368,9,24E144036484A442,Schmeeckle 2025 Master.csv,10 26\20251023,24E144036484A442_20251023_235754T.WAV,24E144036484A442_20251023_235754_000,NA,NA,LPO,2,24.545,243.574,24.534,2.556,72.964,4.211,1.03,NA,2025-10-23T23:57:54Z
LPO,10/23/2025 18:58:08,2025-10-23,18:58:08,18,LASCIN,0.842,22.268,17.06,0,0.217312,NA,NA,NA,NA,19,19,13.65,1,0,28.662,21.416,9,24E144036484A442,Schmeeckle 2025 Master.csv,10 26\20251023,24E144036484A442_20251023_235808T.WAV,24E144036484A442_20251023_235808_000,NA,NA,LPO,16,23.648,333.233,23.336,7.079,144.647,11.072,3.34,NA,2025-10-23T23:58:08Z
MCE,10/23/2025 20:19:06,2025-10-23,20:19:06,20,EPTFUS,0.625,24.237,17.47,0,0.126042,NA,NA,NA,NA,17,16,9.768,1,0,29.141,23.732,9,24A04F085FDF19C0,Schmeeckle 2025 Master.csv,10 26\20251024,24A04F085FDF19C0_20251024_011906T.WAV,24A04F085FDF19C0_20251024_011906_000,NA,NA,MCE,10,25.481,468.638,25.428,4.012,86.578,8.409,3.02,NA,2025-10-24T01:19:06Z
LPO,10/24/2025 03:54:48,2025-10-24,03:54:48,3,LASNOC,0.368,24.748,16.5,0,0.108837,NA,NA,NA,NA,19,19,10.356,1,0,31.689,23.939,9,24E144036484A442,Schmeeckle 2025 Master.csv,10 26\20251024,24E144036484A442_20251024_085448T.WAV,24E144036484A442_20251024_085448_000,NA,NA,LPO,7,26.215,424.323,25.844,4.556,170.555,8.445,2.25,NA,2025-10-24T08:54:48Z
LPI,10/24/2025 19:29:38,2025-10-24,19:29:38,19,LASCIN,0.923,14.603,1.26,0,0.351192,NA,NA,NA,NA,40,39,8.256,1,0,14.754,14.49,9,245AAA0666BC08AE,Schmeeckle 2025 Master.csv,10 26\20251025,245AAA0666BC08AE_20251025_002938T.WAV,245AAA0666BC08AE_20251025_002938_000,NA,NA,LPI,36,14.611,214.909,14.624,3.325,-0.177,5.995,10.32,NA,2025-10-25T00:29:38Z
MCE,10/24/2025 19:39:54,2025-10-24,19:39:54,19,LASCIN,0.389,24.023,9.04,0,0.138787,NA,NA,NA,NA,19,18,7.302,1,0,26.291,23.434,9,24A04F085FDF19C0,Schmeeckle 2025 Master.csv,10 26\20251025,24A04F085FDF19C0_20251025_003954T.WAV,24A04F085FDF19C0_20251025_003954_000,NA,NA,MCE,7,24.414,343.776,24.696,2.073,83.1,5.394,4.02,NA,2025-10-25T00:39:54Z
LPO,10/24/2025 19:44:06,2025-10-24,19:44:06,19,LASCIN,0.556,24.44,17.57,0,0.183336,NA,NA,NA,NA,9,9,9.616,1,0,31.306,23.987,9,24E144036484A442,Schmeeckle 2025 Master.csv,10 26\20251025,24E144036484A442_20251025_004406T.WAV,24E144036484A442_20251025_004406_000,NA,NA,LPO,5,26.212,403.258,25.211,5.329,89.595,7.946,1.9,NA,2025-10-25T00:44:06Z
LPI,10/24/2025 19:59:30,2025-10-24,19:59:30,19,LASNOC,0.474,24.41,9.38,0,0.124725,NA,NA,NA,NA,20,19,4.742,1,0,26.288,23.924,9,245AAA0666BC08AE,Schmeeckle 2025 Master.csv,10 26\20251025,245AAA0666BC08AE_20251025_005930T.WAV,245AAA0666BC08AE_20251025_005930_000,NA,NA,LPI,9,24.803,457.592,24.625,2.73,98.265,3.931,7.26,NA,2025-10-25T00:59:30Z
LPO,10/24/2025 20:33:34,2025-10-24,20:33:34,20,EPTFUS,0.714,24.479,13.41,0,0.202889,NA,NA,NA,NA,14,14,10.064,1,0,35.765,23.822,9,24E144036484A442,Schmeeckle 2025 Master.csv,10 26\20251025,24E144036484A442_20251025_013334T.WAV,24E144036484A442_20251025_013334_000,NA,NA,LPO,10,27.017,326.847,25.636,5.292,201.441,8.966,2.23,NA,2025-10-25T01:33:34Z
LPI,10/24/2025 21:30:02,2025-10-24,21:30:02,21,EPTFUS,0.5,21.547,-9.96,0,0.104054,NA,NA,NA,NA,4,4,2.683,1,0,21.697,21.24,9,245AAA0666BC08AE,Schmeeckle 2025 Master.csv,10 26\20251025,245AAA0666BC08AE_20251025_023002T.WAV,245AAA0666BC08AE_20251025_023002_000,NA,NA,LPI,2,21.46,129.893,21.405,0.614,7.295,1.924,0.98,NA,2025-10-25T02:30:02Z
LPO,10/25/2025 21:43:20,2025-10-25,21:43:20,21,LASCIN,0.5,24.441,-2.8,0,0.171916,NA,NA,NA,NA,4,4,5.933,1,0,24.95,23.984,9,24E144036484A442,Schmeeckle 2025 Master.csv,10 26\20251026,24E144036484A442_20251026_024320T.WAV,24E144036484A442_20251026_024320_000,NA,NA,LPO,2,24.431,91.409,24.528,2.77,43.339,4.041,0.6,NA,2025-10-26T02:43:20Z
LPE,10/19/2025 22:26:42,2025-10-19,22:26:42,22,EPTFUS,0.757,27.889,35.96,0.000,0.277263,LASNOC,NA,NA,NA,39,37,4.780,1,0,40.243,26.845,9.000,245AAA0666BC1507,id.csv,10 21\20251020,245AAA0666BC1507_20251020_032642T.WAV,245AAA0666BC1507_20251020_032642_000,NA,NA,NA,28,31.078,228.734,28.826,3.215,343.460,4.315,7.40,NA,2025-10-20T03:26:42Z
LPE,10/14/2025 19:14:54,2025-10-14,19:14:54,19,EPTFUS,0.697,29.383,59.54,0.000,0.218344,LASNOC,NA,NA,NA,39,33,4.249,1,0,46.638,28.863,9.000,245AAA0666BC1507,id.csv,10 19\20251015,245AAA0666BC1507_20251015_001454T.WAV,245AAA0666BC1507_20251015_001454_000,NA,NA,NA,23,34.586,148.619,30.710,3.268,377.321,4.049,5.39,NA,2025-10-15T00:14:54Z
LPE,10/20/2025 19:56:12,2025-10-20,19:56:12,19,EPTFUS,0.733,26.194,31.93,0.000,0.310005,LASNOC,NA,NA,NA,31,30,6.762,1,0,41.021,25.905,9.000,245AAA0666BC1507,id.csv,10 21\20251021,245AAA0666BC1507_20251021_005612T.WAV,245AAA0666BC1507_20251021_005612_000,NA,NA,NA,22,30.112,289.161,27.322,4.648,341.926,6.424,5.18,NA,2025-10-21T00:56:12Z
LPE,10/16/2025 20:18:36,2025-10-16,20:18:36,20,EPTFUS,0.789,27.474,31.42,0.000,0.376836,LASNOC,NA,NA,NA,20,19,5.712,1,0,37.701,27.097,9.000,245AAA0666BC1507,id.csv,10 19\20251017,245AAA0666BC1507_20251017_011836T.WAV,245AAA0666BC1507_20251017_011836_000,NA,NA,NA,15,30.603,152.162,28.155,4.239,222.410,5.463,5.02,NA,2025-10-17T01:18:36Z
LPE,10/22/2025 20:27:42,2025-10-22,20:27:42,20,EPTFUS,0.867,26.773,37.80,0.000,0.359545,LASNOC,NA,NA,NA,15,15,4.544,1,0,34.741,26.572,9.000,245AAA0666BC1507,id.csv,10 26\20251023,245AAA0666BC1507_20251023_012742T.WAV,245AAA0666BC1507_20251023_012742_000,NA,NA,NA,13,29.263,381.064,27.564,3.071,192.898,4.256,2.95,NA,2025-10-23T01:27:42Z
LPE,10/18/2025 20:19:00,2025-10-18,20:19:00,20,EPTFUS,0.706,26.319,34.08,0.000,0.278173,LASNOC,LASCIN,NA,NA,18,17,5.127,1,0,33.622,26.067,9.000,245AAA0666BC1507,id.csv,10 19\20251019,245AAA0666BC1507_20251019_011900T.WAV,245AAA0666BC1507_20251019_011900_000,NA,NA,NA,12,28.513,322.163,27.252,3.333,209.815,4.756,4.17,NA,2025-10-19T01:19:00Z
LPE,10/17/2025 19:03:24,2025-10-17,19:03:24,19,EPTFUS,0.733,35.687,58.26,0.000,0.270972,LASNOC,NA,NA,NA,17,15,4.472,1,0,52.476,33.721,9.000,245AAA0666BC1507,id.csv,10 19\20251018,245AAA0666BC1507_20251018_000324T.WAV,245AAA0666BC1507_20251018_000324_000,NA,NA,NA,11,40.157,437.626,37.072,2.914,291.427,4.176,4.16,NA,2025-10-18T00:03:24Z
LPE,10/25/2025 20:02:30,2025-10-25,20:02:30,20,EPTFUS,0.688,26.320,43.05,0.000,0.311133,LASNOC,NA,NA,NA,17,16,5.059,1,0,37.878,25.865,9.000,245AAA0666BC1507,id.csv,10 26\20251026,245AAA0666BC1507_20251026_010230T.WAV,245AAA0666BC1507_20251026_010230_000,NA,NA,NA,11,29.582,304.721,27.357,3.400,291.845,4.788,3.82,NA,2025-10-26T01:02:30Z
LPE,10/16/2025 20:18:50,2025-10-16,20:18:50,20,EPTFUS,0.533,27.766,31.75,0.000,0.203948,LASNOC,NA,NA,NA,15,15,5.527,1,0,37.355,27.495,9.000,245AAA0666BC1507,id.csv,10 19\20251017,245AAA0666BC1507_20251017_011850T.WAV,245AAA0666BC1507_20251017_011850_000,NA,NA,NA,8,30.667,377.979,28.835,3.734,249.532,5.163,3.85,NA,2025-10-17T01:18:50Z
LPE,10/17/2025 06:33:12,2025-10-17,06:33:12,6,EPTFUS,1.000,89.395,-59.42,0.000,0.241863,NA,NA,NA,NA,8,7,3.891,1,0,96.967,76.870,9.000,245AAA0666BC1507,id.csv,10 19\20251017,245AAA0666BC1507_20251017_113312T.WAV,245AAA0666BC1507_20251017_113312_000,NA,NA,NA,7,87.726,294.486,88.482,2.204,-142.934,2.536,9.93,NA,2025-10-17T11:33:12Z
LPE,10/19/2025 22:26:28,2025-10-19,22:26:28,22,EPTFUS,1.000,27.181,40.26,0.000,0.380571,NA,NA,NA,NA,7,7,4.198,1,0,35.483,26.671,9.000,245AAA0666BC1507,id.csv,10 21\20251020,245AAA0666BC1507_20251020_032628T.WAV,245AAA0666BC1507_20251020_032628_000,NA,NA,NA,7,29.675,147.079,28.208,2.567,221.265,3.974,1.58,NA,2025-10-20T03:26:28Z
LPE,10/24/2025 01:31:58,2025-10-24,01:31:58,1,EPTFUS,1.000,26.283,16.01,0.000,0.359292,NA,NA,NA,NA,6,6,7.471,1,0,34.687,26.123,9.000,245AAA0666BC1507,id.csv,10 26\20251024,245AAA0666BC1507_20251024_063158T.WAV,245AAA0666BC1507_20251024_063158_000,NA,NA,NA,6,28.884,364.835,26.755,6.131,220.800,7.097,1.28,NA,2025-10-24T06:31:58Z
LPE,10/17/2025 06:36:56,2025-10-17,06:36:56,6,EPTFUS,1.000,87.718,267.58,0.000,0.243500,NA,NA,NA,NA,6,6,3.517,1,0,102.374,81.162,9.000,245AAA0666BC1507,id.csv,10 19\20251017,245AAA0666BC1507_20251017_113656T.WAV,245AAA0666BC1507_20251017_113656_000,NA,NA,NA,6,90.940,593.407,92.514,1.369,-1139.083,1.646,7.81,NA,2025-10-17T11:36:56Z
LPE,10/18/2025 23:34:18,2025-10-18,23:34:18,23,EPTFUS,0.857,26.418,36.92,0.000,0.393061,LASNOC,NA,NA,NA,8,7,4.638,1,0,36.171,26.185,9.000,245AAA0666BC1507,id.csv,10 19\20251019,245AAA0666BC1507_20251019_043418T.WAV,245AAA0666BC1507_20251019_043418_000,NA,NA,NA,6,29.334,409.292,27.452,3.132,278.889,4.424,2.21,NA,2025-10-19T04:34:18Z
LPE,10/18/2025 18:51:44,2025-10-18,18:51:44,18,EPTFUS,0.750,28.235,60.03,0.000,0.245775,LASNOC,NA,NA,NA,8,8,5.012,1,0,41.644,27.716,9.000,245AAA0666BC1507,id.csv,10 19\20251018,245AAA0666BC1507_20251018_235144T.WAV,245AAA0666BC1507_20251018_235144_000,NA,NA,NA,6,31.949,155.271,30.196,3.347,338.068,4.802,1.09,NA,2025-10-18T23:51:44Z
LPE,10/19/2025 22:26:56,2025-10-19,22:26:56,22,EPTFUS,1.000,30.875,77.30,0.000,0.136669,NA,NA,NA,NA,9,5,3.406,1,0,39.454,27.776,9.000,245AAA0666BC1507,id.csv,10 21\20251020,245AAA0666BC1507_20251020_032656T.WAV,245AAA0666BC1507_20251020_032656_000,NA,NA,NA,5,32.072,187.882,33.071,1.177,370.972,2.382,2.37,NA,2025-10-20T03:26:56Z
LPE,10/17/2025 06:23:24,2025-10-17,06:23:24,6,EPTFUS,1.000,90.275,12.62,0.000,0.240204,NA,NA,NA,NA,6,5,2.544,1,0,101.203,79.257,9.000,245AAA0666BC1507,id.csv,10 19\20251017,245AAA0666BC1507_20251017_112324T.WAV,245AAA0666BC1507_20251017_112324_000,NA,NA,NA,5,89.908,834.631,89.910,1.192,-668.376,1.479,8.96,NA,2025-10-17T11:23:24Z
LPE,10/17/2025 18:58:16,2025-10-17,18:58:16,18,EPTFUS,0.500,27.596,25.98,0.000,0.240162,LASNOC,NA,NA,NA,9,8,4.055,1,0,33.263,27.196,9.000,245AAA0666BC1507,id.csv,10 19\20251017,245AAA0666BC1507_20251017_235816T.WAV,245AAA0666BC1507_20251017_235816_000,NA,NA,NA,4,29.299,909.165,28.409,2.781,152.545,3.779,2.63,NA,2025-10-17T23:58:16Z
LPE,10/17/2025 06:29:28,2025-10-17,06:29:28,6,EPTFUS,1.000,88.720,137.06,0.000,0.237487,NA,NA,NA,NA,3,3,2.519,1,0,98.105,74.398,9.000,245AAA0666BC1507,id.csv,10 19\20251017,245AAA0666BC1507_20251017_112928T.WAV,245AAA0666BC1507_20251017_112928_000,NA,NA,NA,3,88.957,166.778,91.957,1.358,-2616.541,1.806,3.44,NA,2025-10-17T11:29:28Z
LPE,10/17/2025 06:24:06,2025-10-17,06:24:06,6,EPTFUS,1.000,85.951,413.85,0.000,0.242328,NA,NA,NA,NA,3,3,2.538,1,0,98.183,77.455,9.000,245AAA0666BC1507,id.csv,10 19\20251017,245AAA0666BC1507_20251017_112406T.WAV,245AAA0666BC1507_20251017_112406_000,NA,NA,NA,3,89.435,3199.040,90.966,1.806,-2556.573,2.117,4.23,NA,2025-10-17T11:24:06Z
LPE,10/17/2025 19:04:20,2025-10-17,19:04:20,19,EPTFUS,1.000,29.028,61.28,0.000,0.341576,NA,NA,NA,NA,3,3,3.205,1,0,34.229,28.680,9.000,245AAA0666BC1507,id.csv,10 19\20251018,245AAA0666BC1507_20251018_000420T.WAV,245AAA0666BC1507_20251018_000420_000,NA,NA,NA,3,31.054,592.887,30.433,2.097,103.128,3.076,1.02,NA,2025-10-18T00:04:20Z
LPE,10/17/2025 06:33:54,2025-10-17,06:33:54,6,EPTFUS,0.750,88.296,14.08,0.000,0.092904,MYOSEP,NA,NA,NA,4,4,2.499,1,0,94.885,73.419,9.000,245AAA0666BC1507,id.csv,10 19\20251017,245AAA0666BC1507_20251017_113354T.WAV,245AAA0666BC1507_20251017_113354_000,NA,NA,NA,3,85.243,1067.089,88.178,1.522,-1734.274,1.727,4.96,NA,2025-10-17T11:33:54Z
LPE,10/17/2025 06:30:24,2025-10-17,06:30:24,6,EPTFUS,0.750,80.962,-463.31,0.000,0.129053,MYOLUC,NA,NA,NA,4,4,2.410,1,0,84.220,66.812,9.000,245AAA0666BC1507,id.csv,10 19\20251017,245AAA0666BC1507_20251017_113024T.WAV,245AAA0666BC1507_20251017_113024_000,NA,NA,NA,3,76.423,1205.337,74.881,1.007,-883.640,1.400,5.25,NA,2025-10-17T11:30:24Z
LPE,10/17/2025 06:24:48,2025-10-17,06:24:48,6,EPTFUS,0.750,84.778,-83.00,0.000,0.127444,MYOLUC,NA,NA,NA,4,4,2.808,1,0,92.333,72.002,9.000,245AAA0666BC1507,id.csv,10 19\20251017,245AAA0666BC1507_20251017_112448T.WAV,245AAA0666BC1507_20251017_112448_000,NA,NA,NA,3,83.241,1121.470,84.832,1.728,-311.139,1.912,6.65,NA,2025-10-17T11:24:48Z
LPE,10/17/2025 22:45:04,2025-10-17,22:45:04,22,EPTFUS,0.750,27.976,62.23,0.000,0.254520,LASNOC,NA,NA,NA,4,4,4.070,1,0,34.529,27.976,9.000,245AAA0666BC1507,id.csv,10 19\20251018,245AAA0666BC1507_20251018_034504T.WAV,245AAA0666BC1507_20251018_034504_000,NA,NA,NA,3,30.356,278.666,30.359,2.366,126.842,3.961,0.77,NA,2025-10-18T03:45:04Z
LPE,10/17/2025 06:32:58,2025-10-17,06:32:58,6,EPTFUS,1.000,84.010,274.39,0.000,0.238493,NA,NA,NA,NA,2,2,2.681,1,0,95.603,78.478,9.000,245AAA0666BC1507,id.csv,10 19\20251017,245AAA0666BC1507_20251017_113258T.WAV,245AAA0666BC1507_20251017_113258_000,NA,NA,NA,2,87.302,22.553,86.145,0.813,-2164.917,0.974,4.55,NA,2025-10-17T11:32:58Z
LPE,10/17/2025 06:32:44,2025-10-17,06:32:44,6,EPTFUS,1.000,89.845,-23.80,0.000,0.225770,NA,NA,NA,NA,2,2,2.238,1,0,98.381,81.334,9.000,245AAA0666BC1507,id.csv,10 19\20251017,245AAA0666BC1507_20251017_113244T.WAV,245AAA0666BC1507_20251017_113244_000,NA,NA,NA,2,91.175,265.166,89.039,1.150,-3368.861,1.303,2.99,NA,2025-10-17T11:32:44Z
LPE,10/17/2025 06:39:02,2025-10-17,06:39:02,6,EPTFUS,1.000,82.271,754.34,0.000,0.240968,NA,NA,NA,NA,2,2,2.994,1,0,98.200,77.719,9.000,245AAA0666BC1507,id.csv,10 19\20251017,245AAA0666BC1507_20251017_113902T.WAV,245AAA0666BC1507_20251017_113902_000,NA,NA,NA,2,90.571,316.371,89.189,1.670,-4646.033,1.812,2.31,NA,2025-10-17T11:39:02Z
LPE,10/17/2025 06:33:26,2025-10-17,06:33:26,6,EPTFUS,1.000,93.124,31.36,0.000,0.234965,NA,NA,NA,NA,2,2,2.852,1,0,98.841,79.679,9.000,245AAA0666BC1507,id.csv,10 19\20251017,245AAA0666BC1507_20251017_113326T.WAV,245AAA0666BC1507_20251017_113326_000,NA,NA,NA,2,90.437,5.562,93.247,1.197,-1596.746,1.648,3.45,NA,2025-10-17T11:33:26Z
LPE,10/17/2025 06:35:04,2025-10-17,06:35:04,6,EPTFUS,1.000,85.145,-57.20,0.000,0.236250,NA,NA,NA,NA,1,2,2.990,1,0,97.619,80.542,9.000,245AAA0666BC1507,id.csv,10 19\20251017,245AAA0666BC1507_20251017_113504T.WAV,245AAA0666BC1507_20251017_113504_000,NA,NA,NA,2,90.969,0.000,84.670,2.367,-1781.561,2.508,3.50,NA,2025-10-17T11:35:04Z
LPE,10/17/2025 19:06:12,2025-10-17,19:06:12,19,EPTFUS,1.000,28.616,31.15,0.000,0.434038,NA,NA,NA,NA,2,2,4.542,1,0,33.831,28.421,9.000,245AAA0666BC1507,id.csv,10 19\20251018,245AAA0666BC1507_20251018_000612T.WAV,245AAA0666BC1507_20251018_000612_000,NA,NA,NA,2,30.241,538.028,29.690,2.598,125.624,4.324,0.42,NA,2025-10-18T00:06:12Z
LPE,10/17/2025 06:37:52,2025-10-17,06:37:52,6,EPTFUS,1.000,89.039,140.08,0.000,0.240632,NA,NA,NA,NA,2,2,2.332,1,0,94.764,71.257,9.000,245AAA0666BC1507,id.csv,10 19\20251017,245AAA0666BC1507_20251017_113752T.WAV,245AAA0666BC1507_20251017_113752_000,NA,NA,NA,2,85.677,274.941,89.756,0.874,-3357.518,1.098,6.70,NA,2025-10-17T11:37:52Z
LPE,10/17/2025 18:58:30,2025-10-17,18:58:30,18,EPTFUS,1.000,30.019,99.05,0.000,0.106688,NA,NA,NA,NA,2,2,2.805,1,0,38.927,29.963,9.000,245AAA0666BC1507,id.csv,10 19\20251017,245AAA0666BC1507_20251017_235830T.WAV,245AAA0666BC1507_20251017_235830_000,NA,NA,NA,2,33.355,123.417,32.525,1.640,217.913,2.805,0.42,NA,2025-10-17T23:58:30Z
LPE,10/17/2025 19:03:52,2025-10-17,19:03:52,19,EPTFUS,0.667,29.544,46.85,0.000,0.205417,LASNOC,NA,NA,NA,3,3,3.107,1,0,34.214,28.892,9.000,245AAA0666BC1507,id.csv,10 19\20251018,245AAA0666BC1507_20251018_000352T.WAV,245AAA0666BC1507_20251018_000352_000,NA,NA,NA,2,30.841,306.336,31.038,1.496,75.066,2.558,0.87,NA,2025-10-18T00:03:52Z
LPE,10/17/2025 19:05:02,2025-10-17,19:05:02,19,EPTFUS,0.667,27.018,26.29,0.000,0.304829,LASNOC,NA,NA,NA,3,3,4.338,1,0,31.526,26.805,9.000,245AAA0666BC1507,id.csv,10 19\20251018,245AAA0666BC1507_20251018_000502T.WAV,245AAA0666BC1507_20251018_000502_000,NA,NA,NA,2,28.644,1513.872,27.794,2.980,140.237,4.287,0.77,NA,2025-10-18T00:05:02Z
LPE,10/17/2025 06:31:06,2025-10-17,06:31:06,6,EPTFUS,0.667,94.198,-432.11,0.000,0.068042,MYOSEP,NA,NA,NA,3,3,2.601,1,0,95.793,68.529,9.000,245AAA0666BC1507,id.csv,10 19\20251017,245AAA0666BC1507_20251017_113106T.WAV,245AAA0666BC1507_20251017_113106_000,NA,NA,NA,2,87.207,1278.122,86.816,1.004,137.265,1.454,4.74,NA,2025-10-17T11:31:06Z
LPE,10/18/2025 19:39:34,2025-10-18,19:39:34,19,EPTFUS,0.667,28.316,13.15,0.000,0.253280,LASNOC,NA,NA,NA,3,3,6.928,1,0,34.434,26.748,9.000,245AAA0666BC1507,id.csv,10 19\20251019,245AAA0666BC1507_20251019_003934T.WAV,245AAA0666BC1507_20251019_003934_000,NA,NA,NA,2,29.873,323.179,28.542,4.671,136.520,5.476,0.70,NA,2025-10-19T00:39:34Z
LPE,10/24/2025 02:23:46,2025-10-24,02:23:46,2,LASBOR,1.000,32.925,4.95,0.000,0.275406,NA,NA,NA,NA,2,2,3.620,1,0,33.762,32.525,9.000,245AAA0666BC1507,id.csv,10 26\20251024,245AAA0666BC1507_20251024_072346T.WAV,245AAA0666BC1507_20251024_072346_000,NA,NA,NA,2,33.076,1135.417,33.062,2.036,135.718,3.067,0.61,NA,2025-10-24T07:23:46Z
LPE,10/17/2025 02:48:30,2025-10-17,02:48:30,2,LASBOR,0.667,43.511,43.95,0.000,0.151072,MYOLUC,NA,NA,NA,3,3,2.597,1,0,47.924,42.894,9.000,245AAA0666BC1507,id.csv,10 19\20251017,245AAA0666BC1507_20251017_074830T.WAV,245AAA0666BC1507_20251017_074830_000,NA,NA,NA,2,44.767,382.500,45.072,1.049,82.204,2.230,1.08,NA,2025-10-17T07:48:30Z
LPE,10/16/2025 22:32:46,2025-10-16,22:32:46,22,LASCIN,0.909,20.039,21.37,0.000,0.345835,EPTFUS,NA,NA,NA,11,11,4.530,1,0,22.222,19.808,9.000,245AAA0666BC1507,id.csv,10 19\20251017,245AAA0666BC1507_20251017_033246T.WAV,245AAA0666BC1507_20251017_033246_000,NA,NA,NA,10,20.622,386.517,20.670,2.149,127.671,3.967,1.60,NA,2025-10-17T03:32:46Z
LPE,10/17/2025 18:37:02,2025-10-17,18:37:02,18,LASCIN,0.900,22.305,20.85,0.000,0.363909,EPTFUS,NA,NA,NA,10,10,4.353,1,0,23.629,21.900,9.000,245AAA0666BC1507,id.csv,10 19\20251017,245AAA0666BC1507_20251017_233702T.WAV,245AAA0666BC1507_20251017_233702_000,NA,NA,NA,9,22.608,367.403,22.903,1.488,72.754,3.275,1.28,NA,2025-10-17T23:37:02Z
LPE,10/16/2025 22:33:14,2025-10-16,22:33:14,22,LASCIN,1.000,19.479,20.77,0.000,0.388475,NA,NA,NA,NA,7,7,5.605,1,0,21.779,19.259,9.000,245AAA0666BC1507,id.csv,10 19\20251017,245AAA0666BC1507_20251017_033314T.WAV,245AAA0666BC1507_20251017_033314_000,NA,NA,NA,7,20.135,602.612,19.922,3.356,98.580,5.071,1.09,NA,2025-10-17T03:33:14Z
LPE,10/24/2025 19:12:06,2025-10-24,19:12:06,19,LASCIN,1.000,23.024,7.34,0.000,0.392935,NA,NA,NA,NA,6,6,3.811,1,0,23.429,22.837,9.000,245AAA0666BC1507,id.csv,10 26\20251025,245AAA0666BC1507_20251025_001206T.WAV,245AAA0666BC1507_20251025_001206_000,NA,NA,NA,6,23.103,113.551,23.124,1.527,-60.903,3.030,1.24,NA,2025-10-25T00:12:06Z
LPE,10/25/2025 20:49:38,2025-10-25,20:49:38,20,LASCIN,1.000,12.942,-2.39,0.000,0.426638,NA,NA,NA,NA,6,6,5.358,1,0,13.049,12.774,9.000,245AAA0666BC1507,id.csv,10 26\20251026,245AAA0666BC1507_20251026_014938T.WAV,245AAA0666BC1507_20251026_014938_000,NA,NA,NA,6,12.907,42.276,12.905,1.851,5.003,3.399,1.49,NA,2025-10-26T01:49:38Z
LPE,10/24/2025 19:59:28,2025-10-24,19:59:28,19,LASCIN,1.000,22.765,30.09,0.000,0.336704,NA,NA,NA,NA,6,6,7.390,1,0,24.513,22.484,9.000,245AAA0666BC1507,id.csv,10 26\20251025,245AAA0666BC1507_20251025_005928T.WAV,245AAA0666BC1507_20251025_005928_000,NA,NA,NA,6,23.397,493.797,23.294,4.862,55.594,6.050,2.43,NA,2025-10-25T00:59:28Z
LPE,10/25/2025 22:12:14,2025-10-25,22:12:14,22,LASCIN,1.000,16.689,7.08,0.000,0.439149,NA,NA,NA,NA,5,5,2.585,1,0,16.921,16.476,9.000,245AAA0666BC1507,id.csv,10 26\20251026,245AAA0666BC1507_20251026_031214T.WAV,245AAA0666BC1507_20251026_031214_000,NA,NA,NA,5,16.717,113.040,16.703,1.101,-2.482,2.107,0.92,NA,2025-10-26T03:12:14Z
LPE,10/22/2025 21:14:22,2025-10-22,21:14:22,21,LASCIN,1.000,16.660,11.67,0.000,0.440104,NA,NA,NA,NA,3,3,2.545,1,0,17.047,16.565,9.000,245AAA0666BC1507,id.csv,10 26\20251023,245AAA0666BC1507_20251023_021422T.WAV,245AAA0666BC1507_20251023_021422_000,NA,NA,NA,3,16.772,91.897,16.703,1.035,47.033,1.752,1.59,NA,2025-10-23T02:14:22Z
LPE,10/17/2025 19:37:00,2025-10-17,19:37:00,19,LASCIN,1.000,23.151,24.19,0.000,0.377709,NA,NA,NA,NA,3,3,3.172,1,0,24.568,22.906,9.000,245AAA0666BC1507,id.csv,10 19\20251018,245AAA0666BC1507_20251018_003700T.WAV,245AAA0666BC1507_20251018_003700_000,NA,NA,NA,3,23.559,408.132,24.028,0.722,52.386,2.710,1.39,NA,2025-10-18T00:37:00Z
LPE,10/24/2025 23:21:18,2025-10-24,23:21:18,23,LASCIN,1.000,11.940,5.24,0.000,0.417446,NA,NA,NA,NA,2,2,3.670,1,0,12.077,11.888,9.000,245AAA0666BC1507,id.csv,10 26\20251025,245AAA0666BC1507_20251025_042118T.WAV,245AAA0666BC1507_20251025_042118_000,NA,NA,NA,2,11.994,203.442,12.015,0.664,-20.659,2.503,0.52,NA,2025-10-25T04:21:18Z
LPE,10/17/2025 18:45:40,2025-10-17,18:45:40,18,LASCIN,1.000,22.729,-4.00,0.000,0.414342,NA,NA,NA,NA,2,2,5.141,1,0,23.291,21.780,9.000,245AAA0666BC1507,id.csv,10 19\20251017,245AAA0666BC1507_20251017_234540T.WAV,245AAA0666BC1507_20251017_234540_000,NA,NA,NA,2,22.566,6842.320,22.728,1.743,-12.444,2.445,0.67,NA,2025-10-17T23:45:40Z
LPE,10/18/2025 19:02:14,2025-10-18,19:02:14,19,LASCIN,1.000,22.794,9.66,0.000,0.399027,NA,NA,NA,NA,2,2,2.619,1,0,23.326,22.637,9.000,245AAA0666BC1507,id.csv,10 19\20251019,245AAA0666BC1507_20251019_000214T.WAV,245AAA0666BC1507_20251019_000214_000,NA,NA,NA,2,22.926,1028.716,23.028,0.780,86.647,2.353,0.84,NA,2025-10-19T00:02:14Z
LPE,10/18/2025 19:26:44,2025-10-18,19:26:44,19,LASCIN,1.000,23.362,15.89,0.000,0.406458,NA,NA,NA,NA,2,2,2.864,1,0,24.281,23.259,9.000,245AAA0666BC1507,id.csv,10 19\20251019,245AAA0666BC1507_20251019_002644T.WAV,245AAA0666BC1507_20251019_002644_000,NA,NA,NA,2,23.744,407.954,23.705,1.586,44.395,2.864,0.91,NA,2025-10-19T00:26:44Z
LPE,10/18/2025 19:40:44,2025-10-18,19:40:44,19,LASCIN,1.000,23.114,3.14,0.000,0.360659,NA,NA,NA,NA,2,2,3.410,1,0,24.106,22.737,9.000,245AAA0666BC1507,id.csv,10 19\20251019,245AAA0666BC1507_20251019_004044T.WAV,245AAA0666BC1507_20251019_004044_000,NA,NA,NA,2,23.358,678.610,23.291,1.687,28.271,2.813,1.04,NA,2025-10-19T00:40:44Z
LPE,10/17/2025 16:35:42,2025-10-17,16:35:42,16,LASCIN,1.000,12.535,-12.93,0.000,0.427147,NA,NA,NA,NA,2,2,5.883,1,0,12.629,12.315,9.000,245AAA0666BC1507,id.csv,10 19\20251017,245AAA0666BC1507_20251017_213542T.WAV,245AAA0666BC1507_20251017_213542_000,NA,NA,NA,2,12.475,733.012,12.334,3.138,5.357,4.941,0.56,NA,2025-10-17T21:35:42Z
LPE,10/17/2025 18:11:50,2025-10-17,18:11:50,18,LASCIN,1.000,9.878,-1.09,0.000,0.406490,NA,NA,NA,NA,2,2,8.271,1,0,10.081,9.778,9.000,245AAA0666BC1507,id.csv,10 19\20251017,245AAA0666BC1507_20251017_231150T.WAV,245AAA0666BC1507_20251017_231150_000,NA,NA,NA,2,9.948,238.767,9.866,3.471,3.323,4.682,0.44,NA,2025-10-17T23:11:50Z
LPE,10/16/2025 20:14:38,2025-10-16,20:14:38,20,LASCIN,1.000,9.867,1.12,0.000,0.406065,NA,NA,NA,NA,2,2,5.465,1,0,9.975,9.836,9.000,245AAA0666BC1507,id.csv,10 19\20251017,245AAA0666BC1507_20251017_011438T.WAV,245AAA0666BC1507_20251017_011438_000,NA,NA,NA,2,9.902,407.349,9.879,1.827,10.031,3.447,0.26,NA,2025-10-17T01:14:38Z
LPE,10/15/2025 23:39:58,2025-10-15,23:39:58,23,LASCIN,0.400,20.422,1.53,0.000,0.108073,EPTFUS,NA,NA,NA,5,5,3.839,1,0,20.654,20.213,9.000,245AAA0666BC1507,id.csv,10 19\20251016,245AAA0666BC1507_20251016_043958T.WAV,245AAA0666BC1507_20251016_043958_000,NA,NA,NA,2,20.429,1460.092,20.389,1.174,-83.320,2.857,2.37,NA,2025-10-16T04:39:58Z
LPE,10/18/2025 02:40:02,2025-10-18,02:40:02,2,LASNOC,0.586,27.297,53.12,0.000,0.262825,EPTFUS,NA,NA,NA,30,29,4.207,1,0,37.540,27.093,9.000,245AAA0666BC1507,id.csv,10 19\20251018,245AAA0666BC1507_20251018_074002T.WAV,245AAA0666BC1507_20251018_074002_000,NA,NA,NA,17,30.368,151.619,28.603,2.824,293.641,4.059,5.53,NA,2025-10-18T07:40:02Z
LPE,10/18/2025 21:12:26,2025-10-18,21:12:26,21,LASNOC,0.727,27.883,29.01,0.000,0.303717,EPTFUS,NA,NA,NA,23,22,4.877,1,0,41.389,27.636,9.000,245AAA0666BC1507,id.csv,10 19\20251019,245AAA0666BC1507_20251019_021226T.WAV,245AAA0666BC1507_20251019_021226_000,NA,NA,NA,16,31.105,182.150,28.746,3.471,393.860,4.725,4.53,NA,2025-10-19T02:12:26Z
LPE,10/24/2025 19:43:50,2025-10-24,19:43:50,19,LASNOC,0.750,25.897,11.95,0.000,0.256296,EPTFUS,NA,NA,NA,21,20,7.381,1,0,33.275,25.430,9.000,245AAA0666BC1507,id.csv,10 26\20251025,245AAA0666BC1507_20251025_004350T.WAV,245AAA0666BC1507_20251025_004350_000,NA,NA,NA,15,27.625,317.553,26.247,4.867,230.792,6.519,4.97,NA,2025-10-25T00:43:50Z
LPE,10/15/2025 18:56:28,2025-10-15,18:56:28,18,LASNOC,0.615,25.750,25.27,0.000,0.216554,EPTFUS,NA,NA,NA,16,13,5.777,1,0,31.829,25.383,9.000,245AAA0666BC1507,id.csv,10 19\20251015,245AAA0666BC1507_20251015_235628T.WAV,245AAA0666BC1507_20251015_235628_000,NA,NA,NA,8,27.446,264.911,26.381,3.968,184.839,5.387,3.97,NA,2025-10-15T23:56:28Z
LPE,10/16/2025 19:17:28,2025-10-16,19:17:28,19,LASNOC,1.000,25.777,19.66,0.000,0.357899,NA,NA,NA,NA,7,7,3.912,1,0,27.665,25.326,9.000,245AAA0666BC1507,id.csv,10 19\20251017,245AAA0666BC1507_20251017_001728T.WAV,245AAA0666BC1507_20251017_001728_000,NA,NA,NA,7,26.299,524.510,26.325,1.945,100.402,3.322,1.81,NA,2025-10-17T00:17:28Z
LPE,10/24/2025 19:59:42,2025-10-24,19:59:42,19,LASNOC,0.778,25.550,18.48,0.000,0.270717,EPTFUS,NA,NA,NA,9,9,9.703,1,0,32.495,25.084,9.000,245AAA0666BC1507,id.csv,10 26\20251025,245AAA0666BC1507_20251025_005942T.WAV,245AAA0666BC1507_20251025_005942_000,NA,NA,NA,7,27.232,271.449,25.933,7.431,182.349,8.636,2.68,NA,2025-10-25T00:59:42Z
LPE,10/16/2025 19:17:42,2025-10-16,19:17:42,19,LASNOC,0.467,25.032,13.67,0.000,0.163739,LASCIN,EPTFUS,NA,NA,15,15,7.780,1,0,29.493,24.269,9.000,245AAA0666BC1507,id.csv,10 19\20251017,245AAA0666BC1507_20251017_001742T.WAV,245AAA0666BC1507_20251017_001742_000,NA,NA,NA,7,26.132,435.368,25.579,4.456,95.333,6.169,5.06,NA,2025-10-17T00:17:42Z
LPE,10/22/2025 23:47:12,2025-10-22,23:47:12,23,LASNOC,0.500,29.529,72.23,0.000,0.141654,EPTFUS,NA,NA,NA,8,8,2.902,1,0,35.882,28.137,9.000,245AAA0666BC1507,id.csv,10 26\20251023,245AAA0666BC1507_20251023_044712T.WAV,245AAA0666BC1507_20251023_044712_000,NA,NA,NA,4,30.992,552.089,31.022,1.549,317.732,2.404,2.96,NA,2025-10-23T04:47:12Z
LPE,10/17/2025 19:00:50,2025-10-17,19:00:50,19,LASNOC,0.750,28.101,41.46,0.000,0.300191,EPTFUS,NA,NA,NA,4,4,2.840,1,0,32.871,27.975,9.000,245AAA0666BC1507,id.csv,10 19\20251018,245AAA0666BC1507_20251018_000050T.WAV,245AAA0666BC1507_20251018_000050_000,NA,NA,NA,3,29.545,124.253,29.098,1.643,240.343,2.804,1.01,NA,2025-10-18T00:00:50Z
LPE,10/17/2025 19:26:58,2025-10-17,19:26:58,19,LASNOC,0.750,27.620,37.93,0.000,0.319590,EPTFUS,NA,NA,NA,4,4,3.641,1,0,34.304,27.307,9.000,245AAA0666BC1507,id.csv,10 19\20251018,245AAA0666BC1507_20251018_002658T.WAV,245AAA0666BC1507_20251018_002658_000,NA,NA,NA,3,29.553,346.557,28.365,2.491,151.829,3.459,1.09,NA,2025-10-18T00:26:58Z
LPE,10/14/2025 18:52:30,2025-10-14,18:52:30,18,LASNOC,0.600,26.039,6.61,0.000,0.280129,EPTFUS,NA,NA,NA,5,5,5.808,1,0,31.379,25.598,9.000,245AAA0666BC1507,id.csv,10 19\20251014,245AAA0666BC1507_20251014_235230T.WAV,245AAA0666BC1507_20251014_235230_000,NA,NA,NA,3,27.311,582.088,26.294,4.208,172.772,5.146,1.67,NA,2025-10-14T23:52:30Z
LPE,10/18/2025 19:22:32,2025-10-18,19:22:32,19,LASNOC,0.600,28.108,33.31,0.000,0.224318,EPTFUS,NA,NA,NA,5,5,3.380,1,0,33.199,27.886,9.000,245AAA0666BC1507,id.csv,10 19\20251019,245AAA0666BC1507_20251019_002232T.WAV,245AAA0666BC1507_20251019_002232_000,NA,NA,NA,3,29.680,384.788,28.886,1.741,185.428,2.618,1.73,NA,2025-10-19T00:22:32Z
LPE,10/24/2025 19:41:16,2025-10-24,19:41:16,19,LASNOC,0.500,26.194,32.06,0.000,0.178529,EPTFUS,NA,NA,NA,6,6,4.304,1,0,31.878,25.415,9.000,245AAA0666BC1507,id.csv,10 26\20251025,245AAA0666BC1507_20251025_004116T.WAV,245AAA0666BC1507_20251025_004116_000,NA,NA,NA,3,27.680,617.388,26.951,2.862,176.131,3.886,1.86,NA,2025-10-25T00:41:16Z
LPE,10/16/2025 20:14:24,2025-10-16,20:14:24,20,LASNOC,0.333,24.489,20.77,0.000,0.100976,LASCIN,EPTFUS,NA,NA,9,9,5.647,1,0,27.660,24.248,9.000,245AAA0666BC1507,id.csv,10 19\20251017,245AAA0666BC1507_20251017_011424T.WAV,245AAA0666BC1507_20251017_011424_000,NA,NA,NA,3,25.345,322.769,25.204,2.917,114.704,5.042,2.65,NA,2025-10-17T01:14:24Z
LPE,10/18/2025 20:51:12,2025-10-18,20:51:12,20,LASNOC,1.000,28.513,28.91,0.000,0.339174,NA,NA,NA,NA,2,2,3.419,1,0,31.945,28.194,9.000,245AAA0666BC1507,id.csv,10 19\20251019,245AAA0666BC1507_20251019_015112T.WAV,245AAA0666BC1507_20251019_015112_000,NA,NA,NA,2,29.440,1218.765,29.005,2.385,173.739,3.144,0.53,NA,2025-10-19T01:51:12Z
LPE,10/17/2025 06:50:28,2025-10-17,06:50:28,6,LASNOC,1.000,24.927,4.38,0.000,0.233619,NA,NA,NA,NA,2,2,2.812,1,0,25.199,24.617,9.000,245AAA0666BC1507,id.csv,10 19\20251017,245AAA0666BC1507_20251017_115028T.WAV,245AAA0666BC1507_20251017_115028_000,NA,NA,NA,2,24.891,796.831,25.001,0.802,-95.210,2.088,0.76,NA,2025-10-17T11:50:28Z
LPE,10/18/2025 19:46:35,2025-10-18,19:46:35,19,LASNOC,0.667,26.876,14.61,0.000,0.293460,EPTFUS,NA,NA,NA,3,3,3.763,1,0,29.292,26.698,8.000,245AAA0666BC1507,id.csv,10 19\20251019,245AAA0666BC1507_20251019_004635T.WAV,245AAA0666BC1507_20251019_004635_000,NA,NA,NA,2,27.525,499.217,27.281,2.185,94.748,3.414,1.92,NA,2025-10-19T00:46:35Z
LPE,10/17/2025 06:08:14,2025-10-17,06:08:14,6,LASNOC,0.667,28.899,-5.00,0.000,0.105658,LASBOR,NA,NA,NA,3,3,3.643,1,0,29.721,28.251,9.000,245AAA0666BC1507,id.csv,10 19\20251017,245AAA0666BC1507_20251017_110814T.WAV,245AAA0666BC1507_20251017_110814_000,NA,NA,NA,2,28.852,498.401,28.820,1.849,164.050,2.836,1.74,NA,2025-10-17T11:08:14Z
LPI,10/24/2025 19:41:04,2025-10-24,19:41:04,19,EPTFUS,0.667,25.412,22.00,0.000,0.256545,LASNOC,NA,NA,NA,7,6,4.961,1,0,32.052,25.090,9.000,245AAA0666BC08AE,id.csv,10 26\20251025,245AAA0666BC08AE_20251025_004104T.WAV,245AAA0666BC08AE_20251025_004104_000,NA,NA,NA,4,27.374,500.718,25.750,3.731,242.312,4.658,1.99,NA,2025-10-25T00:41:04Z
LPI,10/24/2025 20:02:18,2025-10-24,20:02:18,20,EPTFUS,0.667,26.139,2.00,0.000,0.222250,LASNOC,NA,NA,NA,3,3,5.511,1,0,30.332,25.710,9.000,245AAA0666BC08AE,id.csv,10 26\20251025,245AAA0666BC08AE_20251025_010218T.WAV,245AAA0666BC08AE_20251025_010218_000,NA,NA,NA,2,27.129,312.701,26.385,3.702,95.281,4.894,0.58,NA,2025-10-25T01:02:18Z
LPI,10/24/2025 19:29:52,2025-10-24,19:29:52,19,LASCIN,1.000,12.622,0.83,0.000,0.424290,NA,NA,NA,NA,29,29,4.826,1,0,12.739,12.543,9.000,245AAA0666BC08AE,id.csv,10 26\20251025,245AAA0666BC08AE_20251025_002952T.WAV,245AAA0666BC08AE_20251025_002952_000,NA,NA,NA,29,12.623,283.439,12.632,1.987,20.635,3.618,6.52,NA,2025-10-25T00:29:52Z
LPI,10/24/2025 19:29:24,2025-10-24,19:29:24,19,LASCIN,1.000,16.170,-2.12,0.000,0.426299,NA,NA,NA,NA,16,16,8.402,1,0,16.362,16.044,9.000,245AAA0666BC08AE,id.csv,10 26\20251025,245AAA0666BC08AE_20251025_002924T.WAV,245AAA0666BC08AE_20251025_002924_000,NA,NA,NA,16,16.187,358.720,16.181,3.371,10.323,5.845,3.65,NA,2025-10-25T00:29:24Z
LPI,10/24/2025 19:50:10,2025-10-24,19:50:10,19,LASCIN,1.000,22.495,6.75,0.000,0.425730,NA,NA,NA,NA,3,3,4.081,1,0,22.860,22.285,9.000,245AAA0666BC08AE,id.csv,10 26\20251025,245AAA0666BC08AE_20251025_005010T.WAV,245AAA0666BC08AE_20251025_005010_000,NA,NA,NA,3,22.541,1131.150,22.599,1.004,83.983,3.431,1.00,NA,2025-10-25T00:50:10Z
LPI,10/24/2025 21:20:56,2025-10-24,21:20:56,21,LASCIN,0.600,23.807,6.69,0.000,0.218610,LASNOC,NA,NA,NA,6,5,5.842,1,0,25.450,23.356,9.000,245AAA0666BC08AE,id.csv,10 26\20251025,245AAA0666BC08AE_20251025_022056T.WAV,245AAA0666BC08AE_20251025_022056_000,NA,NA,NA,3,24.290,327.384,24.123,3.575,58.225,4.966,2.41,NA,2025-10-25T02:20:56Z
LPI,10/24/2025 19:45:58,2025-10-24,19:45:58,19,LASCIN,1.000,21.370,-9.81,0.000,0.373657,NA,NA,NA,NA,2,2,3.299,1,0,21.569,20.916,9.000,245AAA0666BC08AE,id.csv,10 26\20251025,245AAA0666BC08AE_20251025_004558T.WAV,245AAA0666BC08AE_20251025_004558_000,NA,NA,NA,2,21.230,5.377,21.255,1.226,-51.468,3.299,0.84,NA,2025-10-25T00:45:58Z
LPI,10/24/2025 19:29:10,2025-10-24,19:29:10,19,LASCIN,1.000,18.570,-0.85,0.000,0.417094,NA,NA,NA,NA,2,2,4.231,1,0,18.646,18.395,9.000,245AAA0666BC08AE,id.csv,10 26\20251025,245AAA0666BC08AE_20251025_002910T.WAV,245AAA0666BC08AE_20251025_002910_000,NA,NA,NA,2,18.543,833.402,18.541,0.713,-40.379,2.356,0.84,NA,2025-10-25T00:29:10Z
LPI,10/24/2025 01:32:00,2025-10-24,01:32:00,1,LASNOC,0.857,25.751,33.23,0.000,0.305382,EPTFUS,NA,NA,NA,7,7,4.539,1,0,29.798,25.239,9.000,245AAA0666BC08AE,id.csv,10 26\20251024,245AAA0666BC08AE_20251024_063200T.WAV,245AAA0666BC08AE_20251024_063200_000,NA,NA,NA,6,26.819,487.026,26.320,2.730,156.706,3.719,3.16,NA,2025-10-24T06:32:00Z
LPI,10/21/2025 19:10:42,2025-10-21,19:10:42,19,LASNOC,1.000,25.733,-10.02,0.000,0.287901,NA,NA,NA,NA,5,5,4.264,1,0,28.360,24.716,9.000,245AAA0666BC08AE,id.csv,10 23\20251022,245AAA0666BC08AE_20251022_001042T.WAV,245AAA0666BC08AE_20251022_001042_000,NA,NA,NA,5,26.025,957.566,25.875,1.907,104.469,3.099,2.09,NA,2025-10-22T00:10:42Z
LPI,10/23/2025 18:57:40,2025-10-23,18:57:40,18,LASNOC,0.714,24.738,19.97,0.000,0.136687,LASCIN,NA,NA,NA,9,7,2.913,1,0,26.505,23.887,9.000,245AAA0666BC08AE,id.csv,10 26\20251023,245AAA0666BC08AE_20251023_235740T.WAV,245AAA0666BC08AE_20251023_235740_000,NA,NA,NA,5,24.893,588.847,25.248,1.120,20.903,2.098,3.87,NA,2025-10-23T23:57:40Z
LPI,10/22/2025 23:47:12,2025-10-22,23:47:12,23,LASNOC,0.714,27.293,27.66,0.000,0.301091,EPTFUS,NA,NA,NA,7,7,4.770,1,0,36.125,26.546,9.000,245AAA0666BC08AE,id.csv,10 23\20251023,245AAA0666BC08AE_20251023_044712T.WAV,245AAA0666BC08AE_20251023_044712_000,NA,NA,NA,5,29.281,275.094,28.032,3.170,315.278,4.315,2.51,NA,2025-10-23T04:47:12Z
LPI,10/24/2025 19:59:44,2025-10-24,19:59:44,19,LASNOC,0.800,24.562,15.69,0.000,0.142675,LASCIN,NA,NA,NA,5,5,5.029,1,0,25.918,24.101,9.000,245AAA0666BC08AE,id.csv,10 26\20251025,245AAA0666BC08AE_20251025_005944T.WAV,245AAA0666BC08AE_20251025_005944_000,NA,NA,NA,4,24.890,613.377,24.976,2.280,14.679,4.097,1.29,NA,2025-10-25T00:59:44Z
LPI,10/24/2025 05:09:56,2025-10-24,05:09:56,5,LASNOC,0.500,25.541,13.14,0.000,0.229419,EPTFUS,NA,NA,NA,6,6,6.995,1,0,34.918,24.976,9.000,245AAA0666BC08AE,id.csv,10 26\20251024,245AAA0666BC08AE_20251024_100956T.WAV,245AAA0666BC08AE_20251024_100956_000,NA,NA,NA,3,27.706,343.530,25.802,5.229,274.518,6.090,1.95,NA,2025-10-24T10:09:56Z
LPO,10/23/2025 20:43:36,2025-10-23,20:43:36,20,EPTFUS,0.667,24.207,2.67,0,0.102213,LASNOC,NA,NA,NA,6,6,8.008,1,0,24.567,23.918,9,24E144036484A442,id.csv,10 26\20251024,24E144036484A442_20251024_014336T.WAV,24E144036484A442_20251024_014336_000,NA,NA,NA,4,24.219,44.992,24.233,2.635,8.397,5.334,1.31,NA,2025-10-24T01:43:36Z
LPO,10/24/2025 19:54:50,2025-10-24,19:54:50,19,EPTFUS,0.667,23.858,-23.34,0,0.079923,LASCIN,NA,NA,NA,3,3,3.479,1,0,24.003,23.439,9,24E144036484A442,id.csv,10 26\20251025,24E144036484A442_20251025_005450T.WAV,24E144036484A442_20251025_005450_000,NA,NA,NA,2,23.738,539.844,23.671,0.788,-42.246,2.577,0.82,NA,2025-10-25T00:54:50Z
LPO,10/25/2025 23:19:28,2025-10-25,23:19:28,23,EPTFUS,0.667,20.662,2.19,0,0.11234,LASCIN,NA,NA,NA,3,3,3.311,1,0,21.059,20.121,9,24E144036484A442,id.csv,10 26\20251026,24E144036484A442_20251026_041928T.WAV,24E144036484A442_20251026_041928_000,NA,NA,NA,2,20.545,185.869,20.682,1.484,-57.587,2.193,1.37,NA,2025-10-26T04:19:28Z
LPO,10/25/2025 20:34:02,2025-10-25,20:34:02,20,LASCIN,0.955,17.835,3.08,0,0.386119,EPTFUS,NA,NA,NA,22,22,3.901,1,0,18.135,17.564,9,24E144036484A442,id.csv,10 26\20251026,24E144036484A442_20251026_013402T.WAV,24E144036484A442_20251026_013402_000,NA,NA,NA,21,17.824,136.824,17.851,1.255,4.476,2.661,6.19,NA,2025-10-26T01:34:02Z
LPO,10/24/2025 19:16:48,2025-10-24,19:16:48,19,LASCIN,0.833,21.161,0.39,0,0.296465,EPTFUS,NA,NA,NA,24,24,4.545,1,0,21.41,20.98,9,24E144036484A442,id.csv,10 26\20251025,24E144036484A442_20251025_001648T.WAV,24E144036484A442_20251025_001648_000,NA,NA,NA,20,21.163,40.653,21.191,1.187,0.828,3.046,7.45,NA,2025-10-25T00:16:48Z
LPO,10/24/2025 19:04:26,2025-10-24,19:04:26,19,LASCIN,0.941,18.796,0.19,0,0.276869,EPTFUS,NA,NA,NA,17,17,21.077,1,0,18.977,18.659,9,24E144036484A442,id.csv,10 26\20251025,24E144036484A442_20251025_000426T.WAV,24E144036484A442_20251025_000426_000,NA,NA,NA,16,18.814,468.24,18.819,7.066,3.953,15.358,9.77,NA,2025-10-25T00:04:26Z
LPO,10/24/2025 23:07:48,2025-10-24,23:07:48,23,LASCIN,1,10.184,1.62,0,0.382179,NA,NA,NA,NA,15,15,8.809,1,0,10.28,10.056,9,24E144036484A442,id.csv,10 26\20251025,24E144036484A442_20251025_040748T.WAV,24E144036484A442_20251025_040748_000,NA,NA,NA,15,10.179,39.24,10.202,3.877,-2.861,5.815,2.63,NA,2025-10-25T04:07:48Z
LPO,10/23/2025 23:56:34,2025-10-23,23:56:34,23,LASCIN,1,13.03,0.78,0,0.41829,NA,NA,NA,NA,12,12,7.622,1,0,13.197,12.91,9,24E144036484A442,id.csv,10 26\20251024,24E144036484A442_20251024_045634T.WAV,24E144036484A442_20251024_045634_000,NA,NA,NA,12,13.024,79.698,13.042,2.423,13.898,4.628,2.42,NA,2025-10-24T04:56:34Z
LPO,10/23/2025 19:26:36,2025-10-23,19:26:36,19,LASCIN,0.923,17.797,-1.56,0,0.382404,EPTFUS,NA,NA,NA,13,13,4.741,1,0,17.922,17.66,9,24E144036484A442,id.csv,10 26\20251024,24E144036484A442_20251024_002636T.WAV,24E144036484A442_20251024_002636_000,NA,NA,NA,12,17.79,29.919,17.784,1.316,20.21,3.167,1.38,NA,2025-10-24T00:26:36Z
LPO,10/24/2025 19:27:46,2025-10-24,19:27:46,19,LASCIN,1,13.988,1.28,0,0.441036,NA,NA,NA,NA,10,10,5.602,1,0,14.159,13.85,9,24E144036484A442,id.csv,10 26\20251025,24E144036484A442_20251025_002746T.WAV,24E144036484A442_20251025_002746_000,NA,NA,NA,10,13.999,637.394,14.002,2.454,7.967,3.72,2.7,NA,2025-10-25T00:27:46Z
LPO,10/24/2025 18:29:12,2025-10-24,18:29:12,18,LASCIN,1,10.683,1.4,0,0.410955,NA,NA,NA,NA,9,9,5.894,1,0,10.792,10.622,9,24E144036484A442,id.csv,10 26\20251024,24E144036484A442_20251024_232912T.WAV,24E144036484A442_20251024_232912_000,NA,NA,NA,9,10.689,128.528,10.68,1.662,6.269,3.825,1.3,NA,2025-10-24T23:29:12Z
LPO,10/24/2025 06:36:02,2025-10-24,06:36:02,6,LASCIN,1,10.96,2.27,0,0.405931,NA,NA,NA,NA,8,8,8.568,1,0,11.079,10.87,9,24E144036484A442,id.csv,10 26\20251024,24E144036484A442_20251024_113602T.WAV,24E144036484A442_20251024_113602_000,NA,NA,NA,8,10.959,75.721,10.984,5.421,-6.553,6.833,2.52,NA,2025-10-24T11:36:02Z
LPO,10/24/2025 21:44:02,2025-10-24,21:44:02,21,LASCIN,1,17.553,-5.17,0,0.441682,NA,NA,NA,NA,7,7,3.931,1,0,17.82,17.344,9,24E144036484A442,id.csv,10 26\20251025,24E144036484A442_20251025_024402T.WAV,24E144036484A442_20251025_024402_000,NA,NA,NA,7,17.546,31.965,17.462,1.269,29.813,2.683,1.38,NA,2025-10-25T02:44:02Z
LPO,10/24/2025 18:10:18,2025-10-24,18:10:18,18,LASCIN,1,18.669,3.27,0,0.249862,NA,NA,NA,NA,7,7,27.351,1,0,18.869,18.49,9,24E144036484A442,id.csv,10 26\20251024,24E144036484A442_20251024_231018T.WAV,24E144036484A442_20251024_231018_000,NA,NA,NA,7,18.69,473.108,18.724,11.886,6.447,14.821,1.15,NA,2025-10-24T23:10:18Z
LPO,10/24/2025 18:10:04,2025-10-24,18:10:04,18,LASCIN,1,18.719,0.54,0,0.298919,NA,NA,NA,NA,5,5,21.226,1,0,19.142,18.477,9,24E144036484A442,id.csv,10 26\20251024,24E144036484A442_20251024_231004T.WAV,24E144036484A442_20251024_231004_000,NA,NA,NA,5,18.721,221.407,18.736,6.622,19.879,9.656,1.07,NA,2025-10-24T23:10:04Z
LPO,10/24/2025 03:55:02,2025-10-24,03:55:02,3,LASCIN,1,23.256,19.43,0,0.40758,NA,NA,NA,NA,5,5,6.236,1,0,25.261,23.011,9,24E144036484A442,id.csv,10 26\20251024,24E144036484A442_20251024_085502T.WAV,24E144036484A442_20251024_085502_000,NA,NA,NA,5,23.912,720.107,23.964,2.986,50.139,5.552,1.24,NA,2025-10-24T08:55:02Z
LPO,10/24/2025 21:57:06,2025-10-24,21:57:06,21,LASCIN,1,16.979,14.55,0,0.452103,NA,NA,NA,NA,5,5,3.985,1,0,17.305,16.822,9,24E144036484A442,id.csv,10 26\20251025,24E144036484A442_20251025_025706T.WAV,24E144036484A442_20251025_025706_000,NA,NA,NA,5,17.039,304.257,17.228,0.983,17.409,2.53,2.12,NA,2025-10-25T02:57:06Z
LPO,10/19/2025 18:42:14,2025-10-19,18:42:14,18,LASCIN,1,17.461,0.31,0,0.394134,NA,NA,NA,NA,5,5,13.916,1,0,17.692,17.265,9,24E144036484A442,id.csv,10 21\20251019,24E144036484A442_20251019_234214T.WAV,24E144036484A442_20251019_234214_000,NA,NA,NA,5,17.445,29.785,17.438,9.139,34.906,10.377,1.9,NA,2025-10-19T23:42:14Z
LPO,10/24/2025 20:37:04,2025-10-24,20:37:04,20,LASCIN,1,18.256,0.73,0,0.284742,NA,NA,NA,NA,4,4,24.375,1,0,18.467,18.12,9,24E144036484A442,id.csv,10 26\20251025,24E144036484A442_20251025_013704T.WAV,24E144036484A442_20251025_013704_000,NA,NA,NA,4,18.256,43.827,18.245,6.052,44.852,22.248,2.93,NA,2025-10-25T01:37:04Z
LPO,10/23/2025 18:40:10,2025-10-23,18:40:10,18,LASCIN,1,13.658,2.51,0,0.435681,NA,NA,NA,NA,4,4,5.611,1,0,13.966,13.577,9,24E144036484A442,id.csv,10 26\20251023,24E144036484A442_20251023_234010T.WAV,24E144036484A442_20251023_234010_000,NA,NA,NA,4,13.713,45.14,13.675,2.04,46.995,3.428,0.91,NA,2025-10-23T23:40:10Z
LPO,10/24/2025 21:03:40,2025-10-24,21:03:40,21,LASCIN,1,19.828,5.14,0,0.275252,NA,NA,NA,NA,4,4,28.817,1,0,20.127,19.755,9,24E144036484A442,id.csv,10 26\20251025,24E144036484A442_20251025_020340T.WAV,24E144036484A442_20251025_020340_000,NA,NA,NA,4,19.912,57.115,19.939,12.401,16.865,19.959,2.51,NA,2025-10-25T02:03:40Z
LPO,10/25/2025 00:58:24,2025-10-25,00:58:24,0,LASCIN,1,11.897,-0.06,0,0.419693,NA,NA,NA,NA,4,4,5.944,1,0,12.071,11.848,9,24E144036484A442,id.csv,10 26\20251025,24E144036484A442_20251025_055824T.WAV,24E144036484A442_20251025_055824_000,NA,NA,NA,4,11.924,609.808,11.927,2.672,12.173,5.272,1.03,NA,2025-10-25T05:58:24Z
LPO,10/24/2025 19:04:12,2025-10-24,19:04:12,19,LASCIN,0.8,18.959,-15.53,0,0.210378,EPTFUS,NA,NA,NA,5,5,32.798,1,0,19.078,18.668,9,24E144036484A442,id.csv,10 26\20251025,24E144036484A442_20251025_000412T.WAV,24E144036484A442_20251025_000412_000,NA,NA,NA,4,18.879,388.587,18.781,18.477,61.379,23.855,1.06,NA,2025-10-25T00:04:12Z
LPO,10/24/2025 19:11:40,2025-10-24,19:11:40,19,LASCIN,1,19.632,5.45,0,0.338809,NA,NA,NA,NA,3,3,18.067,1,0,19.987,19.527,9,24E144036484A442,id.csv,10 26\20251025,24E144036484A442_20251025_001140T.WAV,24E144036484A442_20251025_001140_000,NA,NA,NA,3,19.728,234.003,19.749,9.422,-12.837,13.737,0.71,NA,2025-10-25T00:11:40Z
LPO,10/19/2025 18:57:10,2025-10-19,18:57:10,18,LASCIN,0.75,20.318,7.02,0,0.253597,EPTFUS,NA,NA,NA,4,4,4.034,1,0,20.542,20.19,9,24E144036484A442,id.csv,10 21\20251019,24E144036484A442_20251019_235710T.WAV,24E144036484A442_20251019_235710_000,NA,NA,NA,3,20.316,12.572,20.422,1.576,60.122,2.855,0.71,NA,2025-10-19T23:57:10Z
LPO,10/24/2025 19:32:26,2025-10-24,19:32:26,19,LASCIN,1,12.832,-9.04,0,0.4245,NA,NA,NA,NA,2,2,11.755,1,0,12.903,12.639,9,24E144036484A442,id.csv,10 26\20251025,24E144036484A442_20251025_003226T.WAV,24E144036484A442_20251025_003226_000,NA,NA,NA,2,12.764,323.904,12.71,0.94,9.883,3.908,0.53,NA,2025-10-25T00:32:26Z
LPO,10/24/2025 19:12:22,2025-10-24,19:12:22,19,LASCIN,1,11.028,5.46,0,0.410447,NA,NA,NA,NA,2,2,4.334,1,0,11.174,10.945,9,24E144036484A442,id.csv,10 26\20251025,24E144036484A442_20251025_001222T.WAV,24E144036484A442_20251025_001222_000,NA,NA,NA,2,11.058,356.859,11.074,0.364,14.067,1.45,0.41,NA,2025-10-25T00:12:22Z
LPO,10/24/2025 19:23:06,2025-10-24,19:23:06,19,LASCIN,1,22.048,0,0,0.409564,NA,NA,NA,NA,2,2,4.407,1,0,22.308,21.84,9,24E144036484A442,id.csv,10 26\20251025,24E144036484A442_20251025_002306T.WAV,24E144036484A442_20251025_002306_000,NA,NA,NA,2,22.022,925.071,22.048,1.315,53.286,3.196,0.42,NA,2025-10-25T00:23:06Z
LPO,10/23/2025 22:40:44,2025-10-23,22:40:44,22,LASCIN,1,15.588,2.29,0,0.448091,NA,NA,NA,NA,2,2,3.474,1,0,15.74,15.446,9,24E144036484A442,id.csv,10 26\20251024,24E144036484A442_20251024_034044T.WAV,24E144036484A442_20251024_034044_000,NA,NA,NA,2,15.613,645.256,15.636,0.918,-3.942,2.838,0.62,NA,2025-10-24T03:40:44Z
LPO,10/24/2025 18:53:56,2025-10-24,18:53:56,18,LASCIN,1,22.535,-9.42,0,0.38842,NA,NA,NA,NA,2,2,7.283,1,0,22.989,22.131,9,24E144036484A442,id.csv,10 26\20251024,24E144036484A442_20251024_235356T.WAV,24E144036484A442_20251024_235356_000,NA,NA,NA,2,22.506,1309.256,22.379,3.638,-30.485,5.682,1.08,NA,2025-10-24T23:53:56Z
LPO,10/24/2025 17:57:00,2025-10-24,17:57:00,17,LASCIN,1,13.094,3.29,0,0.427934,NA,NA,NA,NA,2,2,4.112,1,0,13.224,13.04,9,24E144036484A442,id.csv,10 26\20251024,24E144036484A442_20251024_225700T.WAV,24E144036484A442_20251024_225700_000,NA,NA,NA,2,13.136,57.312,13.148,1.369,-43.598,3.197,0.44,NA,2025-10-24T22:57:00Z
LPO,10/23/2025 22:44:00,2025-10-23,22:44:00,22,LASCIN,1,22.286,15.32,0,0.391507,NA,NA,NA,NA,2,2,3.484,1,0,22.728,22.072,9,24E144036484A442,id.csv,10 26\20251024,24E144036484A442_20251024_034400T.WAV,24E144036484A442_20251024_034400_000,NA,NA,NA,2,22.388,24.723,22.442,0.98,-11.397,1.876,0.72,NA,2025-10-24T03:44:00Z
LPO,10/12/2025 18:44:34,2025-10-12,18:44:34,18,LASCIN,1,15.646,5.42,0,0.436691,NA,NA,NA,NA,2,2,2.3,1,0,15.893,15.231,9,24E144036484A442,id.csv,10 19\20251012,24E144036484A442_20251012_234434T.WAV,24E144036484A442_20251012_234434_000,NA,NA,NA,2,15.653,2468.256,15.722,1.15,-71.084,1.919,1.21,NA,2025-10-12T23:44:34Z
LPO,10/24/2025 18:18:42,2025-10-24,18:18:42,18,LASCIN,1,21.477,-4.24,0,0.444535,NA,NA,NA,NA,2,2,9.629,1,0,21.652,21.164,9,24E144036484A442,id.csv,10 26\20251024,24E144036484A442_20251024_231842T.WAV,24E144036484A442_20251024_231842_000,NA,NA,NA,2,21.399,55.512,21.37,2.897,121.961,6.355,0.56,NA,2025-10-24T23:18:42Z
LPO,10/24/2025 20:03:28,2025-10-24,20:03:28,20,LASNOC,0.525,26.354,20.14,0,0.223577,EPTFUS,NA,NA,NA,60,59,8.458,1,0,34.981,25.887,9,24E144036484A442,id.csv,10 26\20251025,24E144036484A442_20251025_010328T.WAV,24E144036484A442_20251025_010328_000,NA,NA,NA,31,28.372,149.388,27.294,4.789,222.066,7.594,8.29,NA,2025-10-25T01:03:28Z
LPO,10/23/2025 22:10:24,2025-10-23,22:10:24,22,LASNOC,1,28.401,13.65,0,0.263305,NA,NA,NA,NA,9,9,2.801,1,0,29.028,28.024,9,24E144036484A442,id.csv,10 26\20251024,24E144036484A442_20251024_031024T.WAV,24E144036484A442_20251024_031024_000,NA,NA,NA,9,28.545,63.353,28.656,0.823,-0.164,1.915,2.53,NA,2025-10-24T03:10:24Z
LPO,10/24/2025 19:45:16,2025-10-24,19:45:16,19,LASNOC,1,26.847,22.19,0,0.333072,NA,NA,NA,NA,3,3,2.854,1,0,27.56,26.757,9,24E144036484A442,id.csv,10 26\20251025,24E144036484A442_20251025_004516T.WAV,24E144036484A442_20251025_004516_000,NA,NA,NA,3,27.111,52.749,27.213,1.181,60.287,2.219,0.89,NA,2025-10-25T00:45:16Z
LPO,10/24/2025 19:34:18,2025-10-24,19:34:18,19,LASNOC,0.75,24.964,23.37,0,0.221813,EPTFUS,NA,NA,NA,4,4,3.329,1,0,26.019,24.678,9,24E144036484A442,id.csv,10 26\20251025,24E144036484A442_20251025_003418T.WAV,24E144036484A442_20251025_003418_000,NA,NA,NA,3,25.251,516.21,25.481,1.574,0.592,2.887,1.57,NA,2025-10-25T00:34:18Z
LPO,10/24/2025 20:33:20,2025-10-24,20:33:20,20,LASNOC,1,24.861,17.47,0,0.195086,NA,NA,NA,NA,2,2,4.948,1,0,26.114,24.027,9,24E144036484A442,id.csv,10 26\20251025,24E144036484A442_20251025_013320T.WAV,24E144036484A442_20251025_013320_000,NA,NA,NA,2,25.004,345.987,25.249,1.965,146.611,3.245,0.7,NA,2025-10-25T01:33:20Z
MCE,10/24/2025 01:30:36,2025-10-24,01:30:36,1,EPTFUS,1,27.818,46.51,0,0.345397,NA,NA,NA,NA,7,5,6.405,1,0,37.871,26.961,9,24A04F085FDF19C0,id.csv,10 26\20251024,24A04F085FDF19C0_20251024_063036T.WAV,24A04F085FDF19C0_20251024_063036_000,NA,NA,NA,5,30.757,287.795,29.348,4.386,200.321,5.855,1.8,NA,2025-10-24T06:30:36Z
MCE,10/21/2025 19:57:22,2025-10-21,19:57:22,19,LASCIN,0.9,23.272,27.19,0,0.244414,EPTFUS,NA,NA,NA,20,20,6.242,1,0,28.803,22.729,9,24A04F085FDF19C0,id.csv,10 23\20251022,24A04F085FDF19C0_20251022_005722T.WAV,24A04F085FDF19C0_20251022_005722_000,NA,NA,NA,18,24.52,362.691,24.477,2.658,143.332,5.311,5.4,NA,2025-10-22T00:57:22Z
MCE,10/24/2025 21:19:46,2025-10-24,21:19:46,21,LASCIN,1,23.287,18.34,0,0.424372,NA,NA,NA,NA,10,10,7.44,1,0,25.312,22.576,9,24A04F085FDF19C0,id.csv,10 26\20251025,24A04F085FDF19C0_20251025_021946T.WAV,24A04F085FDF19C0_20251025_021946_000,NA,NA,NA,10,23.812,527.099,24.304,2.138,60.773,5.605,1.43,NA,2025-10-25T02:19:46Z
MCE,10/15/2025 00:56:16,2025-10-15,00:56:16,0,LASCIN,1,22.204,15.41,0,0.438333,NA,NA,NA,NA,8,8,5.792,1,0,24.284,21.793,9,24A04F085FDF19C0,id.csv,10 17\20251015,24A04F085FDF19C0_20251015_055616T.WAV,24A04F085FDF19C0_20251015_055616_000,NA,NA,NA,8,22.811,430.272,22.793,2.873,70.738,4.895,1.5,NA,2025-10-15T05:56:16Z
MCE,10/15/2025 00:56:02,2025-10-15,00:56:02,0,LASCIN,0.8,23.066,22.58,0,0.33347,LASNOC,NA,NA,NA,5,5,6.63,1,0,26.567,22.749,9,24A04F085FDF19C0,id.csv,10 17\20251015,24A04F085FDF19C0_20251015_055602T.WAV,24A04F085FDF19C0_20251015_055602_000,NA,NA,NA,4,24.261,523.467,23.867,4.175,129,6.139,1.2,NA,2025-10-15T05:56:02Z
MCE,10/15/2025 19:37:46,2025-10-15,19:37:46,19,LASCIN,1,22.884,-5.8,0,0.330121,NA,NA,NA,NA,3,3,4.373,1,0,23.957,22.712,9,24A04F085FDF19C0,id.csv,10 17\20251016,24A04F085FDF19C0_20251016_003746T.WAV,24A04F085FDF19C0_20251016_003746_000,NA,NA,NA,3,23.16,517.243,23.342,0.802,-13.342,3.907,0.67,NA,2025-10-16T00:37:46Z
MCE,10/24/2025 21:20:00,2025-10-24,21:20:00,21,LASCIN,1,21.883,9.11,0,0.451755,NA,NA,NA,NA,2,2,5.776,1,0,23.226,21.278,9,24A04F085FDF19C0,id.csv,10 26\20251025,24A04F085FDF19C0_20251025_022000T.WAV,24A04F085FDF19C0_20251025_022000_000,NA,NA,NA,2,22.173,891.458,22.039,3.237,95.602,4.225,0.67,NA,2025-10-25T02:20:00Z
SME,10/17/2025 18:54:22,2025-10-17,18:54:22,18,EPTFUS,0.881,28.836,51.18,0.000,0.356383,LASNOC,NA,NA,NA,44,42,4.792,1,0,40.963,28.607,9.000,247AA5015FDF19F3,id.csv,10 19\20251017,247AA5015FDF19F3_20251017_235422T.WAV,247AA5015FDF19F3_20251017_235422_000,NA,NA,NA,37,32.375,170.706,30.220,3.332,264.604,4.589,9.66,NA,2025-10-17T23:54:22Z
SME,10/19/2025 20:21:38,2025-10-19,20:21:38,20,EPTFUS,0.750,27.626,53.89,0.000,0.344487,LASNOC,NA,NA,NA,4,4,3.557,1,0,34.258,27.312,9.000,247AA5015FDF19F3,id.csv,10 26\20251020,247AA5015FDF19F3_20251020_012138T.WAV,247AA5015FDF19F3_20251020_012138_000,NA,NA,NA,3,29.791,390.694,28.756,2.263,158.720,3.302,0.71,NA,2025-10-20T01:21:38Z
LPE,10/05/2025 21:52:38,2025-10-05,21:52:38,21,MYOLUC,1,51.455,122.43,0,0.407724,LASBOR,NA,NA,NA,4,4,2.289,1,0,67.509,51.041,9,245AAA0666BC1507,Schmeeckle 2025 Master.csv,LPE\10 09\20251006,245AAA0666BC1507_20251006_025238T.WAV,245AAA0666BC1507_20251006_025238_000T.wav,NA,C:\Users\Nancy\Desktop\Bat Files,C:\Users\Nancy\Desktop\AutoID\10 09 Output,4,56.974,183.345,56.752,0.995,323.7,2.191,1.22,NA,2025-10-06T02:52:38Z
LPE,10/06/2025 00:05:38,2025-10-06,00:05:38,0,LASBOR,0.857,37.278,11.76,0,0.227876,MYOLUC,NA,NA,NA,7,7,4.649,1,0,43.246,37.078,9,245AAA0666BC1507,Schmeeckle 2025 Master.csv,LPE\10 09\20251006,245AAA0666BC1507_20251006_050538T.WAV,245AAA0666BC1507_20251006_050538_000T.wav,NA,C:\Users\Nancy\Desktop\Bat Files,C:\Users\Nancy\Desktop\AutoID\10 09 Output,6,38.446,268.327,37.747,2.423,299.59,4.262,1.86,NA,2025-10-06T05:05:38Z
LPE,10/06/2025 03:37:58,2025-10-06,03:37:58,3,LASNOC,0.412,26.073,15.76,0,0.223275,LASCIN,EPTFUS,NA,NA,17,17,5.988,1,0,28.841,25.769,9,245AAA0666BC1507,Schmeeckle 2025 Master.csv,LPE\10 09\20251006,245AAA0666BC1507_20251006_083758T.WAV,245AAA0666BC1507_20251006_083758_000T.wav,NA,C:\Users\Nancy\Desktop\Bat Files,C:\Users\Nancy\Desktop\AutoID\10 09 Output,7,26.81,446.689,26.673,3.011,101.71,5.182,5.24,NA,2025-10-06T08:37:58Z
LPE,10/06/2025 04:00:50,2025-10-06,04:00:50,4,LASNOC,0.8,28.401,21.41,0,0.329977,EPTFUS,LASCIN,NA,NA,10,10,3.616,1,0,43.332,28.196,9,245AAA0666BC1507,Schmeeckle 2025 Master.csv,LPE\10 09\20251006,245AAA0666BC1507_20251006_090050T.WAV,245AAA0666BC1507_20251006_090050_000T.wav,NA,C:\Users\Nancy\Desktop\Bat Files,C:\Users\Nancy\Desktop\AutoID\10 09 Output,8,32.184,101.707,28.908,2.509,376.52,3.39,2.25,NA,2025-10-06T09:00:50Z
LPE,10/06/2025 04:03:24,2025-10-06,04:03:24,4,LASNOC,0.789,27.553,10.51,0,0.316539,EPTFUS,LASCIN,NA,NA,19,19,5.268,1,0,31.867,27.196,8.746667,245AAA0666BC1507,Schmeeckle 2025 Master.csv,LPE\10 09\20251006,245AAA0666BC1507_20251006_090324T.WAV,245AAA0666BC1507_20251006_090324_000T.wav,NA,C:\Users\Nancy\Desktop\Bat Files,C:\Users\Nancy\Desktop\AutoID\10 09 Output,15,28.594,314.205,28.003,3.084,179.17,4.8,4.68,NA,2025-10-06T09:03:24Z
LPE,10/06/2025 04:09:00,2025-10-06,04:09:00,4,LASNOC,0.625,24.942,15.55,0,0.238506,LASCIN,EPTFUS,NA,NA,8,8,7.273,1,0,26.848,24.71,6.270667,245AAA0666BC1507,Schmeeckle 2025 Master.csv,LPE\10 09\20251006,245AAA0666BC1507_20251006_090900T.WAV,245AAA0666BC1507_20251006_090900_000T.wav,NA,C:\Users\Nancy\Desktop\Bat Files,C:\Users\Nancy\Desktop\AutoID\10 09 Output,5,25.582,440.048,25.205,5.102,57.8,6.294,2.25,NA,2025-10-06T09:09:00Z
LPE,10/06/2025 04:09:14,2025-10-06,04:09:14,4,LASNOC,1,26.754,-4.56,0,0.454002,LASCIN,EPTFUS,NA,NA,6,6,6.196,1,0,29.501,26.344,9,245AAA0666BC1507,Schmeeckle 2025 Master.csv,LPE\10 09\20251006,245AAA0666BC1507_20251006_090914T.WAV,245AAA0666BC1507_20251006_090914_000T.wav,NA,C:\Users\Nancy\Desktop\Bat Files,C:\Users\Nancy\Desktop\AutoID\10 09 Output,6,27.3,356.331,26.96,3.505,192.03,5.015,1.12,NA,2025-10-06T09:09:14Z
LPE,10/06/2025 04:13:54,2025-10-06,04:13:54,4,LASNOC,0.9,27.057,0.35,0,0.330376,LASCIN,EPTFUS,NA,NA,10,10,4.993,1,0,28.125,26.508,9,245AAA0666BC1507,Schmeeckle 2025 Master.csv,LPE\10 09\20251006,245AAA0666BC1507_20251006_091354T.WAV,245AAA0666BC1507_20251006_091354_000T.wav,NA,C:\Users\Nancy\Desktop\Bat Files,C:\Users\Nancy\Desktop\AutoID\10 09 Output,9,27.197,184.621,27.262,2.894,61.36,3.973,2.61,NA,2025-10-06T09:13:54Z
LPE,10/06/2025 04:14:08,2025-10-06,04:14:08,4,LASNOC,1,26.492,5.54,0,0.437335,LASCIN,EPTFUS,NA,NA,3,3,5.168,1,0,26.817,26.345,6.613333,245AAA0666BC1507,Schmeeckle 2025 Master.csv,LPE\10 09\20251006,245AAA0666BC1507_20251006_091408T.WAV,245AAA0666BC1507_20251006_091408_000T.wav,NA,C:\Users\Nancy\Desktop\Bat Files,C:\Users\Nancy\Desktop\AutoID\10 09 Output,3,26.576,702.248,26.671,2.004,37.28,3.71,0.46,NA,2025-10-06T09:14:08Z
LPE,10/06/2025 04:17:10,2025-10-06,04:17:10,4,LASNOC,0.707,27.866,37.13,0,0.372912,EPTFUS,LASCIN,NA,NA,41,41,4.723,1,0,39.942,27.535,9,245AAA0666BC1507,Schmeeckle 2025 Master.csv,LPE\10 09\20251006,245AAA0666BC1507_20251006_091710T.WAV,245AAA0666BC1507_20251006_091710_000T.wav,NA,C:\Users\Nancy\Desktop\Bat Files,C:\Users\Nancy\Desktop\AutoID\10 09 Output,29,30.698,164.684,28.927,2.786,341.24,4.369,6.67,NA,2025-10-06T09:17:10Z
LPE,10/06/2025 04:17:24,2025-10-06,04:17:24,4,LASNOC,0.875,26.139,12.27,0,0.349746,LASCIN,EPTFUS,NA,NA,8,8,5.308,1,0,29.091,25.774,5.758667,245AAA0666BC1507,Schmeeckle 2025 Master.csv,LPE\10 09\20251006,245AAA0666BC1507_20251006_091724T.WAV,245AAA0666BC1507_20251006_091724_000T.wav,NA,C:\Users\Nancy\Desktop\Bat Files,C:\Users\Nancy\Desktop\AutoID\10 09 Output,7,26.817,635.036,26.579,2.483,127.62,4.074,1.58,NA,2025-10-06T09:17:24Z
LPE,10/06/2025 04:22:32,2025-10-06,04:22:32,4,LASNOC,0.824,27.45,16.29,0,0.409604,EPTFUS,LASCIN,NA,NA,17,17,5.346,1,0,33.914,27.019,9,245AAA0666BC1507,Schmeeckle 2025 Master.csv,LPE\10 09\20251006,245AAA0666BC1507_20251006_092232T.WAV,245AAA0666BC1507_20251006_092232_000T.wav,NA,C:\Users\Nancy\Desktop\Bat Files,C:\Users\Nancy\Desktop\AutoID\10 09 Output,14,28.764,352.933,27.991,2.924,230.03,4.506,3.56,NA,2025-10-06T09:22:32Z
LPE,10/06/2025 04:22:46,2025-10-06,04:22:46,4,LASNOC,0.786,27.755,37.39,0,0.47367,EPTFUS,LASCIN,NA,NA,14,14,5.158,1,0,39.949,27.417,9,245AAA0666BC1507,Schmeeckle 2025 Master.csv,LPE\10 09\20251006,245AAA0666BC1507_20251006_092246T.WAV,245AAA0666BC1507_20251006_092246_000T.wav,NA,C:\Users\Nancy\Desktop\Bat Files,C:\Users\Nancy\Desktop\AutoID\10 09 Output,11,30.298,220.991,28.748,3.268,452.71,4.667,3.69,NA,2025-10-06T09:22:46Z
LPE,10/06/2025 04:23:00,2025-10-06,04:23:00,4,LASNOC,0.636,27.36,16.15,0,0.358436,EPTFUS,LASCIN,NA,NA,22,22,5.395,1,0,33.175,26.98,8.916,245AAA0666BC1507,Schmeeckle 2025 Master.csv,LPE\10 09\20251006,245AAA0666BC1507_20251006_092300T.WAV,245AAA0666BC1507_20251006_092300_000T.wav,NA,C:\Users\Nancy\Desktop\Bat Files,C:\Users\Nancy\Desktop\AutoID\10 09 Output,14,28.56,243.093,27.93,3.159,241.2,4.752,3.79,NA,2025-10-06T09:23:00Z
LPE,10/06/2025 04:25:34,2025-10-06,04:25:34,4,LASNOC,1,27.451,18.32,0,0.493579,EPTFUS,LASCIN,NA,NA,2,2,6.872,1,0,32.003,27.08,8.489333,245AAA0666BC1507,Schmeeckle 2025 Master.csv,LPE\10 09\20251006,245AAA0666BC1507_20251006_092534T.WAV,245AAA0666BC1507_20251006_092534_000T.wav,NA,C:\Users\Nancy\Desktop\Bat Files,C:\Users\Nancy\Desktop\AutoID\10 09 Output,2,28.52,470.116,27.928,4.763,145.66,6.213,0.64,NA,2025-10-06T09:25:34Z
LPE,10/06/2025 04:28:36,2025-10-06,04:28:36,4,EPTFUS,1,28.558,20.16,0,0.45106,LASNOC,LASCIN,NA,NA,4,4,5.16,1,0,35.304,28.125,9,245AAA0666BC1507,Schmeeckle 2025 Master.csv,LPE\10 09\20251006,245AAA0666BC1507_20251006_092836T.WAV,245AAA0666BC1507_20251006_092836_000T.wav,NA,C:\Users\Nancy\Desktop\Bat Files,C:\Users\Nancy\Desktop\AutoID\10 09 Output,4,30.586,173.539,29.024,3.677,183.58,4.726,0.78,NA,2025-10-06T09:28:36Z
LPE,10/06/2025 04:28:50,2025-10-06,04:28:50,4,LASNOC,0.381,26.588,49.8,0,0.28998,LASCIN,EPTFUS,NA,NA,63,63,5.252,1,0,46.025,26.081,9,245AAA0666BC1507,Schmeeckle 2025 Master.csv,LPE\10 09\20251006,245AAA0666BC1507_20251006_092850T.WAV,245AAA0666BC1507_20251006_092850_000T.wav,NA,C:\Users\Nancy\Desktop\Bat Files,C:\Users\Nancy\Desktop\AutoID\10 09 Output,24,30.59,119.852,28.094,3.304,516.05,4.954,8.33,NA,2025-10-06T09:28:50Z
LPE,10/06/2025 04:31:24,2025-10-06,04:31:24,4,LASNOC,0.833,27.516,22.25,0,0.397505,EPTFUS,LASCIN,NA,NA,12,12,6.166,1,0,33.737,27.287,9,245AAA0666BC1507,Schmeeckle 2025 Master.csv,LPE\10 09\20251006,245AAA0666BC1507_20251006_093124T.WAV,245AAA0666BC1507_20251006_093124_000T.wav,NA,C:\Users\Nancy\Desktop\Bat Files,C:\Users\Nancy\Desktop\AutoID\10 09 Output,10,28.912,354.993,28.352,3.614,170.71,5.736,2.32,NA,2025-10-06T09:31:24Z
LPE,10/06/2025 04:31:38,2025-10-06,04:31:38,4,LASNOC,0.667,28.265,14.27,0,0.331578,EPTFUS,LASCIN,NA,NA,6,6,4.451,1,0,33.289,28.083,8.745333,245AAA0666BC1507,Schmeeckle 2025 Master.csv,LPE\10 09\20251006,245AAA0666BC1507_20251006_093138T.WAV,245AAA0666BC1507_20251006_093138_000T.wav,NA,C:\Users\Nancy\Desktop\Bat Files,C:\Users\Nancy\Desktop\AutoID\10 09 Output,4,29.345,728.405,28.716,3.017,228.3,4.288,1.08,NA,2025-10-06T09:31:38Z
LPE,10/06/2025 04:32:34,2025-10-06,04:32:34,4,LASNOC,0.606,27.886,36.42,0,0.27072,EPTFUS,LASCIN,NA,NA,33,33,4.886,1,0,39.069,27.58,9,245AAA0666BC1507,Schmeeckle 2025 Master.csv,LPE\10 09\20251006,245AAA0666BC1507_20251006_093234T.WAV,245AAA0666BC1507_20251006_093234_000T.wav,NA,C:\Users\Nancy\Desktop\Bat Files,C:\Users\Nancy\Desktop\AutoID\10 09 Output,20,30.612,266.737,28.841,3.245,324.28,4.64,5.47,NA,2025-10-06T09:32:34Z
LPE,10/06/2025 04:33:44,2025-10-06,04:33:44,4,LASNOC,0.789,27.666,22.53,0,0.384834,EPTFUS,LASCIN,NA,NA,38,38,6.18,1,0,41.291,27.51,9,245AAA0666BC1507,Schmeeckle 2025 Master.csv,LPE\10 09\20251006,245AAA0666BC1507_20251006_093344T.WAV,245AAA0666BC1507_20251006_093344_000T.wav,NA,C:\Users\Nancy\Desktop\Bat Files,C:\Users\Nancy\Desktop\AutoID\10 09 Output,30,30.296,173.003,28.49,4.077,401.54,5.906,5.43,NA,2025-10-06T09:33:44Z
LPE,10/06/2025 04:35:36,2025-10-06,04:35:36,4,LASNOC,0.5,27.795,9.87,0,0.361001,EPTFUS,LASCIN,NA,NA,10,10,3.991,1,0,38.377,27.334,7.210667,245AAA0666BC1507,Schmeeckle 2025 Master.csv,LPE\10 09\20251006,245AAA0666BC1507_20251006_093536T.WAV,245AAA0666BC1507_20251006_093536_000T.wav,NA,C:\Users\Nancy\Desktop\Bat Files,C:\Users\Nancy\Desktop\AutoID\10 09 Output,5,30.522,104.659,28.207,2.773,234.52,3.697,1.82,NA,2025-10-06T09:35:36Z
LPE,10/06/2025 04:35:50,2025-10-06,04:35:50,4,LASNOC,0.467,27.214,37.16,0,0.330285,EPTFUS,LASCIN,NA,NA,45,45,5.213,1,0,38.807,26.902,7.977333,245AAA0666BC1507,Schmeeckle 2025 Master.csv,LPE\10 09\20251006,245AAA0666BC1507_20251006_093550T.WAV,245AAA0666BC1507_20251006_093550_000T.wav,NA,C:\Users\Nancy\Desktop\Bat Files,C:\Users\Nancy\Desktop\AutoID\10 09 Output,21,30.125,150.859,28.092,3.432,289.52,4.843,6.95,NA,2025-10-06T09:35:50Z
LPE,10/06/2025 04:36:04,2025-10-06,04:36:04,4,LASNOC,0.333,26.46,30.02,0,0.291094,EPTFUS,LASCIN,NA,NA,21,21,5.533,1,0,35.597,26.186,9,245AAA0666BC1507,Schmeeckle 2025 Master.csv,LPE\10 09\20251006,245AAA0666BC1507_20251006_093604T.WAV,245AAA0666BC1507_20251006_093604_000T.wav,NA,C:\Users\Nancy\Desktop\Bat Files,C:\Users\Nancy\Desktop\AutoID\10 09 Output,7,28.494,284.469,27.166,3.729,284.33,4.932,5.7,NA,2025-10-06T09:36:04Z
LPE,10/06/2025 04:36:46,2025-10-06,04:36:46,4,EPTFUS,0.4,29.074,27.12,0,0.250747,LASNOC,NA,NA,NA,5,5,2.69,1,0,33.199,28.632,9,245AAA0666BC1507,Schmeeckle 2025 Master.csv,LPE\10 09\20251006,245AAA0666BC1507_20251006_093646T.WAV,245AAA0666BC1507_20251006_093646_000T.wav,NA,C:\Users\Nancy\Desktop\Bat Files,C:\Users\Nancy\Desktop\AutoID\10 09 Output,2,30.108,1827.449,29.787,1.52,194.73,2.444,1.34,NA,2025-10-06T09:36:46Z
LPE,10/06/2025 04:37:00,2025-10-06,04:37:00,4,LASNOC,0.533,28.702,76.08,0,0.202096,EPTFUS,NA,NA,NA,15,15,3.342,1,0,38.085,28.343,9,245AAA0666BC1507,Schmeeckle 2025 Master.csv,LPE\10 09\20251006,245AAA0666BC1507_20251006_093700T.WAV,245AAA0666BC1507_20251006_093700_000T.wav,NA,C:\Users\Nancy\Desktop\Bat Files,C:\Users\Nancy\Desktop\AutoID\10 09 Output,8,31.226,527.453,30.112,2.11,323.96,3.169,2.87,NA,2025-10-06T09:37:00Z
LPE,10/06/2025 04:37:14,2025-10-06,04:37:14,4,LASNOC,0.667,26.175,14.35,0,0.357159,EPTFUS,LASCIN,NA,NA,6,6,6.725,1,0,30.997,25.979,9,245AAA0666BC1507,Schmeeckle 2025 Master.csv,LPE\10 09\20251006,245AAA0666BC1507_20251006_093714T.WAV,245AAA0666BC1507_20251006_093714_000T.wav,NA,C:\Users\Nancy\Desktop\Bat Files,C:\Users\Nancy\Desktop\AutoID\10 09 Output,4,27.305,245.782,26.568,4.649,120.7,6.392,1.01,NA,2025-10-06T09:37:14Z
LPE,10/06/2025 04:37:42,2025-10-06,04:37:42,4,LASNOC,0.613,27.589,21.24,0,0.278336,EPTFUS,LASCIN,NA,NA,31,31,4.954,1,0,33.479,27.314,9,245AAA0666BC1507,Schmeeckle 2025 Master.csv,LPE\10 09\20251006,245AAA0666BC1507_20251006_093742T.WAV,245AAA0666BC1507_20251006_093742_000T.wav,NA,C:\Users\Nancy\Desktop\Bat Files,C:\Users\Nancy\Desktop\AutoID\10 09 Output,19,28.977,172.593,28.11,3.287,169.97,4.54,8.88,NA,2025-10-06T09:37:42Z
LPE,10/06/2025 04:37:56,2025-10-06,04:37:56,4,LASNOC,0.615,27.853,61.68,0,0.347798,EPTFUS,LASCIN,NA,NA,13,13,3.846,1,0,40.483,27.623,7.977333,245AAA0666BC1507,Schmeeckle 2025 Master.csv,LPE\10 09\20251006,245AAA0666BC1507_20251006_093756T.WAV,245AAA0666BC1507_20251006_093756_000T.wav,NA,C:\Users\Nancy\Desktop\Bat Files,C:\Users\Nancy\Desktop\AutoID\10 09 Output,8,31.266,169.19,29.427,2.446,341.72,3.745,2.66,NA,2025-10-06T09:37:56Z
LPE,10/06/2025 04:38:52,2025-10-06,04:38:52,4,LASNOC,0.75,27.39,41.27,0,0.224489,EPTFUS,LASCIN,NA,NA,4,4,3.965,1,0,31.843,27.188,5.673333,245AAA0666BC1507,Schmeeckle 2025 Master.csv,LPE\10 09\20251006,245AAA0666BC1507_20251006_093852T.WAV,245AAA0666BC1507_20251006_093852_000T.wav,NA,C:\Users\Nancy\Desktop\Bat Files,C:\Users\Nancy\Desktop\AutoID\10 09 Output,3,28.345,1257.729,27.776,2.525,305.75,3.372,1.49,NA,2025-10-06T09:38:52Z
LPE,10/06/2025 04:40:19,2025-10-06,04:40:19,4,LASNOC,0.375,27.854,49.91,0,0.26982,EPTFUS,LASCIN,NA,NA,16,16,4.223,1,0,35.854,27.514,6,245AAA0666BC1507,Schmeeckle 2025 Master.csv,LPE\10 09\20251006,245AAA0666BC1507_20251006_094019T.WAV,245AAA0666BC1507_20251006_094019_000T.wav,NA,C:\Users\Nancy\Desktop\Bat Files,C:\Users\Nancy\Desktop\AutoID\10 09 Output,6,29.913,307.514,29.42,2.329,294.99,3.903,2.82,NA,2025-10-06T09:40:19Z
LPE,10/06/2025 04:40:58,2025-10-06,04:40:58,4,LASNOC,0.667,27.749,17.29,0,0.372455,EPTFUS,LASCIN,NA,NA,3,3,4.311,1,0,30.97,27.492,6.612,245AAA0666BC1507,Schmeeckle 2025 Master.csv,LPE\10 09\20251006,245AAA0666BC1507_20251006_094058T.WAV,245AAA0666BC1507_20251006_094058_000T.wav,NA,C:\Users\Nancy\Desktop\Bat Files,C:\Users\Nancy\Desktop\AutoID\10 09 Output,2,28.462,503.875,28.173,2.634,251.87,3.877,1.14,NA,2025-10-06T09:40:58Z
LPE,10/06/2025 04:42:22,2025-10-06,04:42:22,4,LASNOC,0.391,27.39,37.19,0,0.292288,EPTFUS,LASCIN,NA,NA,23,23,5.246,1,0,41.178,27.128,9,245AAA0666BC1507,Schmeeckle 2025 Master.csv,LPE\10 09\20251006,245AAA0666BC1507_20251006_094222T.WAV,245AAA0666BC1507_20251006_094222_000T.wav,NA,C:\Users\Nancy\Desktop\Bat Files,C:\Users\Nancy\Desktop\AutoID\10 09 Output,9,30.652,246.455,28.342,3.709,339.7,4.996,4.76,NA,2025-10-06T09:42:22Z
LPE,10/06/2025 04:43:18,2025-10-06,04:43:18,4,LASNOC,0.714,27.354,47.89,0,0.379299,EPTFUS,LASCIN,NA,NA,35,35,5.321,1,0,42.23,27.047,9,245AAA0666BC1507,Schmeeckle 2025 Master.csv,LPE\10 09\20251006,245AAA0666BC1507_20251006_094318T.WAV,245AAA0666BC1507_20251006_094318_000T.wav,NA,C:\Users\Nancy\Desktop\Bat Files,C:\Users\Nancy\Desktop\AutoID\10 09 Output,25,30.629,157.126,28.694,3.362,400.49,4.98,5.93,NA,2025-10-06T09:43:18Z
LPE,10/06/2025 04:43:46,2025-10-06,04:43:46,4,LASNOC,0.5,27.796,47.82,0,0.359544,EPTFUS,LASCIN,NA,NA,28,28,4.14,1,0,39.686,27.371,8.404,245AAA0666BC1507,Schmeeckle 2025 Master.csv,LPE\10 09\20251006,245AAA0666BC1507_20251006_094346T.WAV,245AAA0666BC1507_20251006_094346_000T.wav,NA,C:\Users\Nancy\Desktop\Bat Files,C:\Users\Nancy\Desktop\AutoID\10 09 Output,14,30.592,258.252,29.089,2.399,317.93,3.724,6.01,NA,2025-10-06T09:43:46Z
LPE,10/06/2025 04:44:42,2025-10-06,04:44:42,4,LASNOC,0.464,27.428,43.89,0,0.312973,EPTFUS,LASCIN,NA,NA,28,28,4.428,1,0,40.188,26.962,9,245AAA0666BC1507,Schmeeckle 2025 Master.csv,LPE\10 09\20251006,245AAA0666BC1507_20251006_094442T.WAV,245AAA0666BC1507_20251006_094442_000T.wav,NA,C:\Users\Nancy\Desktop\Bat Files,C:\Users\Nancy\Desktop\AutoID\10 09 Output,13,30.123,173.748,28.515,2.769,424.52,4.062,7.46,NA,2025-10-06T09:44:42Z
LPE,10/06/2025 04:45:10,2025-10-06,04:45:10,4,LASNOC,0.868,28.071,39.45,0,0.391606,EPTFUS,LASCIN,NA,NA,38,38,4.558,1,0,40.563,27.828,9,245AAA0666BC1507,Schmeeckle 2025 Master.csv,LPE\10 09\20251006,245AAA0666BC1507_20251006_094510T.WAV,245AAA0666BC1507_20251006_094510_000T.wav,NA,C:\Users\Nancy\Desktop\Bat Files,C:\Users\Nancy\Desktop\AutoID\10 09 Output,33,30.971,198.603,29.014,3.164,332.15,4.323,9.48,NA,2025-10-06T09:45:10Z
LPE,10/06/2025 04:46:20,2025-10-06,04:46:20,4,EPTFUS,0.591,28.694,47.07,0,0.257694,LASNOC,LASCIN,NA,NA,22,22,4.7,1,0,37.705,28.416,9,245AAA0666BC1507,Schmeeckle 2025 Master.csv,LPE\10 09\20251006,245AAA0666BC1507_20251006_094620T.WAV,245AAA0666BC1507_20251006_094620_000T.wav,NA,C:\Users\Nancy\Desktop\Bat Files,C:\Users\Nancy\Desktop\AutoID\10 09 Output,13,31.18,347.236,30.404,2.824,293.47,4.404,4.26,NA,2025-10-06T09:46:20Z
LPE,10/06/2025 04:47:30,2025-10-06,04:47:30,4,LASNOC,0.857,28.245,12.4,0,0.381755,EPTFUS,LASCIN,NA,NA,7,7,5.433,1,0,33.836,27.923,8.745333,245AAA0666BC1507,Schmeeckle 2025 Master.csv,LPE\10 09\20251006,245AAA0666BC1507_20251006_094730T.WAV,245AAA0666BC1507_20251006_094730_000T.wav,NA,C:\Users\Nancy\Desktop\Bat Files,C:\Users\Nancy\Desktop\AutoID\10 09 Output,6,29.603,234.26,28.719,3.538,193.46,5.005,1.22,NA,2025-10-06T09:47:30Z
LPE,10/06/2025 04:48:12,2025-10-06,04:48:12,4,LASNOC,0.762,27.524,24.5,0,0.377064,EPTFUS,LASCIN,NA,NA,42,42,6.639,1,0,35.987,27.271,8.830667,245AAA0666BC1507,Schmeeckle 2025 Master.csv,LPE\10 09\20251006,245AAA0666BC1507_20251006_094812T.WAV,245AAA0666BC1507_20251006_094812_000T.wav,NA,C:\Users\Nancy\Desktop\Bat Files,C:\Users\Nancy\Desktop\AutoID\10 09 Output,32,29.511,198.646,28.376,4.32,273.42,6.166,7.39,NA,2025-10-06T09:48:12Z
LPE,10/06/2025 04:52:38,2025-10-06,04:52:38,4,LASNOC,0.674,27.732,32.4,0,0.338652,EPTFUS,LASCIN,NA,NA,46,46,4.962,1,0,38.843,27.518,9,245AAA0666BC1507,Schmeeckle 2025 Master.csv,LPE\10 09\20251006,245AAA0666BC1507_20251006_095238T.WAV,245AAA0666BC1507_20251006_095238_000T.wav,NA,C:\Users\Nancy\Desktop\Bat Files,C:\Users\Nancy\Desktop\AutoID\10 09 Output,31,30.342,191.922,28.728,3.264,324.58,4.742,9.49,NA,2025-10-06T09:52:38Z
LPE,10/06/2025 04:53:06,2025-10-06,04:53:06,4,LASNOC,0.625,27.293,37.24,0,0.522943,EPTFUS,LASCIN,NA,NA,8,8,5.142,1,0,41.585,27,7.465333,245AAA0666BC1507,Schmeeckle 2025 Master.csv,LPE\10 09\20251006,245AAA0666BC1507_20251006_095306T.WAV,245AAA0666BC1507_20251006_095306_000T.wav,NA,C:\Users\Nancy\Desktop\Bat Files,C:\Users\Nancy\Desktop\AutoID\10 09 Output,5,30.559,131.962,28.698,3.197,394.51,4.831,1.57,NA,2025-10-06T09:53:06Z
LPE,10/06/2025 04:53:20,2025-10-06,04:53:20,4,LASNOC,0.393,26.354,57.58,0,0.287192,LASCIN,EPTFUS,NA,NA,28,28,5.482,1,0,43.408,25.768,8.916,245AAA0666BC1507,Schmeeckle 2025 Master.csv,LPE\10 09\20251006,245AAA0666BC1507_20251006_095320T.WAV,245AAA0666BC1507_20251006_095320_000T.wav,NA,C:\Users\Nancy\Desktop\Bat Files,C:\Users\Nancy\Desktop\AutoID\10 09 Output,11,30.312,153.952,28.476,3.273,460.85,5.128,4.39,NA,2025-10-06T09:53:20Z
LPE,10/06/2025 04:53:48,2025-10-06,04:53:48,4,LASNOC,0.694,27.657,67.03,0,0.42052,EPTFUS,LASCIN,NA,NA,36,36,4.319,1,0,45.222,27.484,8.318667,245AAA0666BC1507,Schmeeckle 2025 Master.csv,LPE\10 09\20251006,245AAA0666BC1507_20251006_095348T.WAV,245AAA0666BC1507_20251006_095348_000T.wav,NA,C:\Users\Nancy\Desktop\Bat Files,C:\Users\Nancy\Desktop\AutoID\10 09 Output,25,32.073,185.505,29.301,2.896,438.45,4.21,5.29,NA,2025-10-06T09:53:48Z
LPE,10/06/2025 04:54:58,2025-10-06,04:54:58,4,LASNOC,0.556,27.633,20.48,0,0.33181,EPTFUS,LASCIN,NA,NA,9,9,4.687,1,0,34.749,27.405,7.892,245AAA0666BC1507,Schmeeckle 2025 Master.csv,LPE\10 09\20251006,245AAA0666BC1507_20251006_095458T.WAV,245AAA0666BC1507_20251006_095458_000T.wav,NA,C:\Users\Nancy\Desktop\Bat Files,C:\Users\Nancy\Desktop\AutoID\10 09 Output,5,29.325,722.586,28.423,2.759,234.39,4.21,1.9,NA,2025-10-06T09:54:58Z
LPE,10/06/2025 04:55:26,2025-10-06,04:55:26,4,LASNOC,0.514,27.579,62.24,0,0.326314,EPTFUS,LASCIN,NA,NA,35,35,4.445,1,0,44.366,27.129,9,245AAA0666BC1507,Schmeeckle 2025 Master.csv,LPE\10 09\20251006,245AAA0666BC1507_20251006_095526T.WAV,245AAA0666BC1507_20251006_095526_000T.wav,NA,C:\Users\Nancy\Desktop\Bat Files,C:\Users\Nancy\Desktop\AutoID\10 09 Output,18,31.468,153.601,29.24,2.753,461.94,4.174,5.06,NA,2025-10-06T09:55:26Z
LPE,10/06/2025 05:01:16,2025-10-06,05:01:16,5,LASNOC,0.667,28.543,12.15,0,0.339341,EPTFUS,LASCIN,NA,NA,3,3,2.587,1,0,34.991,28.141,7.977333,245AAA0666BC1507,Schmeeckle 2025 Master.csv,LPE\10 09\20251006,245AAA0666BC1507_20251006_100116T.WAV,245AAA0666BC1507_20251006_100116_000T.wav,NA,C:\Users\Nancy\Desktop\Bat Files,C:\Users\Nancy\Desktop\AutoID\10 09 Output,2,29.894,359.405,28.918,1.65,302.95,2.35,0.81,NA,2025-10-06T10:01:16Z
LPE,10/06/2025 05:02:12,2025-10-06,05:02:12,5,LASBOR,1,45.341,99.46,0,0.49548,PERSUB,MYOLUC,NA,NA,2,2,2.794,1,0,58.887,44.577,9,245AAA0666BC1507,Schmeeckle 2025 Master.csv,LPE\10 09\20251006,245AAA0666BC1507_20251006_100212T.WAV,245AAA0666BC1507_20251006_100212_000T.wav,NA,C:\Users\Nancy\Desktop\Bat Files,C:\Users\Nancy\Desktop\AutoID\10 09 Output,2,49.429,129.596,50.166,1.046,358.51,2.615,0.51,NA,2025-10-06T10:02:12Z
LPE,10/06/2025 05:03:08,2025-10-06,05:03:08,5,LASNOC,0.871,28.614,85.79,0,0.29975,EPTFUS,LASCIN,NA,NA,31,31,4.11,1,0,43.005,28.374,9,245AAA0666BC1507,Schmeeckle 2025 Master.csv,LPE\10 09\20251006,245AAA0666BC1507_20251006_100308T.WAV,245AAA0666BC1507_20251006_100308_000T.wav,NA,C:\Users\Nancy\Desktop\Bat Files,C:\Users\Nancy\Desktop\AutoID\10 09 Output,27,32.46,277.757,30.558,2.715,420.52,3.95,4.14,NA,2025-10-06T10:03:08Z
LPE,10/06/2025 05:04:46,2025-10-06,05:04:46,5,LASNOC,0.385,27.176,61,0,0.292044,EPTFUS,LASCIN,NA,NA,52,52,4.068,1,0,39.64,26.827,8.830667,245AAA0666BC1507,Schmeeckle 2025 Master.csv,LPE\10 09\20251006,245AAA0666BC1507_20251006_100446T.WAV,245AAA0666BC1507_20251006_100446_000T.wav,NA,C:\Users\Nancy\Desktop\Bat Files,C:\Users\Nancy\Desktop\AutoID\10 09 Output,20,30.188,153.899,28.677,2.401,447.32,3.795,11.01,NA,2025-10-06T10:04:46Z
LPE,10/06/2025 05:05:00,2025-10-06,05:05:00,5,LASNOC,0.526,27.208,51.95,0,0.369973,EPTFUS,LASCIN,NA,NA,19,19,3.996,1,0,41.182,27.07,9,245AAA0666BC1507,Schmeeckle 2025 Master.csv,LPE\10 09\20251006,245AAA0666BC1507_20251006_100500T.WAV,245AAA0666BC1507_20251006_100500_000T.wav,NA,C:\Users\Nancy\Desktop\Bat Files,C:\Users\Nancy\Desktop\AutoID\10 09 Output,10,30.417,262.269,29.005,2.118,428.43,3.87,3.66,NA,2025-10-06T10:05:00Z
LPE,10/06/2025 05:08:16,2025-10-06,05:08:16,5,LASNOC,0.429,27.037,36.86,0,0.282647,EPTFUS,LASCIN,NA,NA,14,14,5.236,1,0,37.658,26.914,9,245AAA0666BC1507,Schmeeckle 2025 Master.csv,LPE\10 09\20251006,245AAA0666BC1507_20251006_100816T.WAV,245AAA0666BC1507_20251006_100816_000T.wav,NA,C:\Users\Nancy\Desktop\Bat Files,C:\Users\Nancy\Desktop\AutoID\10 09 Output,6,29.822,159.912,28.004,3.51,277.69,5.068,3,NA,2025-10-06T10:08:16Z
LPE,10/06/2025 05:08:58,2025-10-06,05:08:58,5,LASNOC,1,29.746,48.7,0,0.278417,EPTFUS,NA,NA,NA,3,3,2.864,1,0,43.489,29.158,9,245AAA0666BC1507,Schmeeckle 2025 Master.csv,LPE\10 09\20251006,245AAA0666BC1507_20251006_100858T.WAV,245AAA0666BC1507_20251006_100858_000T.wav,NA,C:\Users\Nancy\Desktop\Bat Files,C:\Users\Nancy\Desktop\AutoID\10 09 Output,3,33.589,139.126,30.349,2.14,377.34,2.723,0.62,NA,2025-10-06T10:08:58Z
LPE,10/06/2025 05:09:40,2025-10-06,05:09:40,5,LASNOC,0.778,27.859,18.75,0,0.362247,EPTFUS,LASCIN,NA,NA,36,36,5.38,1,0,35.545,27.502,8.318667,245AAA0666BC1507,Schmeeckle 2025 Master.csv,LPE\10 09\20251006,245AAA0666BC1507_20251006_100940T.WAV,245AAA0666BC1507_20251006_100940_000T.wav,NA,C:\Users\Nancy\Desktop\Bat Files,C:\Users\Nancy\Desktop\AutoID\10 09 Output,28,29.604,179.115,28.368,3.627,240.34,4.959,8.59,NA,2025-10-06T10:09:40Z
LPE,10/06/2025 05:13:10,2025-10-06,05:13:10,5,LASNOC,0.442,27.109,52.01,0,0.263835,EPTFUS,LASCIN,NA,NA,43,43,5.12,1,0,43.328,26.719,9,245AAA0666BC1507,Schmeeckle 2025 Master.csv,LPE\10 09\20251006,245AAA0666BC1507_20251006_101310T.WAV,245AAA0666BC1507_20251006_101310_000T.wav,NA,C:\Users\Nancy\Desktop\Bat Files,C:\Users\Nancy\Desktop\AutoID\10 09 Output,19,30.845,202.39,28.454,3.477,393.79,4.812,8.73,NA,2025-10-06T10:13:10Z
LPE,10/06/2025 05:13:24,2025-10-06,05:13:24,5,LASNOC,0.75,26.894,17.54,0,0.397774,EPTFUS,LASCIN,NA,NA,4,4,8.551,1,0,34.048,26.499,5.588,245AAA0666BC1507,Schmeeckle 2025 Master.csv,LPE\10 09\20251006,245AAA0666BC1507_20251006_101324T.WAV,245AAA0666BC1507_20251006_101324_000T.wav,NA,C:\Users\Nancy\Desktop\Bat Files,C:\Users\Nancy\Desktop\AutoID\10 09 Output,3,28.401,331.805,27.912,4.06,133.92,7.172,0.93,NA,2025-10-06T10:13:24Z
LPE,10/06/2025 05:13:38,2025-10-06,05:13:38,5,LASNOC,1,27.08,38.6,0,0.501629,EPTFUS,LASCIN,NA,NA,5,5,6.096,1,0,35.153,26.93,4.821333,245AAA0666BC1507,Schmeeckle 2025 Master.csv,LPE\10 09\20251006,245AAA0666BC1507_20251006_101338T.WAV,245AAA0666BC1507_20251006_101338_000T.wav,NA,C:\Users\Nancy\Desktop\Bat Files,C:\Users\Nancy\Desktop\AutoID\10 09 Output,5,29.067,301.696,27.52,5.168,224.49,5.947,1.05,NA,2025-10-06T10:13:38Z
LPE,10/06/2025 05:16:40,2025-10-06,05:16:40,5,LASNOC,0.776,28.105,39.86,0,0.337816,EPTFUS,LASCIN,NA,NA,49,49,5.084,1,0,39.555,27.739,9,245AAA0666BC1507,Schmeeckle 2025 Master.csv,LPE\10 09\20251006,245AAA0666BC1507_20251006_101640T.WAV,245AAA0666BC1507_20251006_101640_000T.wav,NA,C:\Users\Nancy\Desktop\Bat Files,C:\Users\Nancy\Desktop\AutoID\10 09 Output,38,30.928,171.959,29.117,3.541,333.18,4.733,8.15,NA,2025-10-06T10:16:40Z
LPE,10/06/2025 05:18:46,2025-10-06,05:18:46,5,LASNOC,0.867,28.35,51.81,0,0.332315,EPTFUS,LASCIN,NA,NA,45,45,4.805,1,0,44.891,28.117,7.465333,245AAA0666BC1507,Schmeeckle 2025 Master.csv,LPE\10 09\20251006,245AAA0666BC1507_20251006_101846T.WAV,245AAA0666BC1507_20251006_101846_000T.wav,NA,C:\Users\Nancy\Desktop\Bat Files,C:\Users\Nancy\Desktop\AutoID\10 09 Output,39,32.364,144.253,29.706,3.243,485.62,4.624,7.53,NA,2025-10-06T10:18:46Z
LPE,10/06/2025 05:19:00,2025-10-06,05:19:00,5,LASNOC,0.333,28.623,59.71,0,0.35074,EPTFUS,NA,NA,NA,3,3,2.495,1,0,36.005,28.115,6.014667,245AAA0666BC1507,Schmeeckle 2025 Master.csv,LPE\10 09\20251006,245AAA0666BC1507_20251006_101900T.WAV,245AAA0666BC1507_20251006_101900_000T.wav,NA,C:\Users\Nancy\Desktop\Bat Files,C:\Users\Nancy\Desktop\AutoID\10 09 Output,1,30.473,144.174,30.083,1.25,328.93,2.305,0.71,NA,2025-10-06T10:19:00Z
LPE,10/06/2025 05:19:14,2025-10-06,05:19:14,5,LASNOC,0.545,27.989,34.63,0,0.286257,EPTFUS,LASCIN,NA,NA,77,77,5.559,1,0,41.867,27.668,9,245AAA0666BC1507,Schmeeckle 2025 Master.csv,LPE\10 09\20251006,245AAA0666BC1507_20251006_101914T.WAV,245AAA0666BC1507_20251006_101914_000T.wav,NA,C:\Users\Nancy\Desktop\Bat Files,C:\Users\Nancy\Desktop\AutoID\10 09 Output,42,31.201,116.424,29.069,3.7,405.75,5.197,13.88,NA,2025-10-06T10:19:14Z
LPE,10/06/2025 05:21:20,2025-10-06,05:21:20,5,LASNOC,0.182,26.349,57,0,0.263843,LASCIN,EPTFUS,NA,NA,22,22,4.806,1,0,39.609,25.917,8.830667,245AAA0666BC1507,Schmeeckle 2025 Master.csv,LPE\10 09\20251006,245AAA0666BC1507_20251006_102120T.WAV,245AAA0666BC1507_20251006_102120_000T.wav,NA,C:\Users\Nancy\Desktop\Bat Files,C:\Users\Nancy\Desktop\AutoID\10 09 Output,4,29.536,258.7,28.125,2.65,415.21,4.455,3.64,NA,2025-10-06T10:21:20Z
LPE,10/06/2025 05:23:12,2025-10-06,05:23:12,5,LASBOR,0.5,40.726,33.85,0,0.237973,PERSUB,MYOLUC,NA,NA,2,2,4.154,1,0,46.123,40.726,8.66,245AAA0666BC1507,Schmeeckle 2025 Master.csv,LPE\10 09\20251006,245AAA0666BC1507_20251006_102312T.WAV,245AAA0666BC1507_20251006_102312_000T.wav,NA,C:\Users\Nancy\Desktop\Bat Files,C:\Users\Nancy\Desktop\AutoID\10 09 Output,1,42.494,318.351,43.613,0.951,237.88,4.009,0.46,NA,2025-10-06T10:23:12Z
LPE,10/06/2025 05:23:40,2025-10-06,05:23:40,5,LASNOC,0.783,27.972,21.52,0,0.358029,EPTFUS,LASCIN,NA,NA,23,23,4.489,1,0,34.899,27.627,8.830667,245AAA0666BC1507,Schmeeckle 2025 Master.csv,LPE\10 09\20251006,245AAA0666BC1507_20251006_102340T.WAV,245AAA0666BC1507_20251006_102340_000T.wav,NA,C:\Users\Nancy\Desktop\Bat Files,C:\Users\Nancy\Desktop\AutoID\10 09 Output,18,29.673,388.42,28.571,2.968,258.51,4.132,6.57,NA,2025-10-06T10:23:40Z
LPE,10/06/2025 05:23:54,2025-10-06,05:23:54,5,LASNOC,0.656,28.297,57.08,0,0.317486,EPTFUS,LASCIN,NA,NA,32,32,4.507,1,0,43.046,27.922,7.550667,245AAA0666BC1507,Schmeeckle 2025 Master.csv,LPE\10 09\20251006,245AAA0666BC1507_20251006_102354T.WAV,245AAA0666BC1507_20251006_102354_000T.wav,NA,C:\Users\Nancy\Desktop\Bat Files,C:\Users\Nancy\Desktop\AutoID\10 09 Output,21,31.886,155.642,30.032,2.632,457.49,4.215,5.64,NA,2025-10-06T10:23:54Z
LPE,10/06/2025 05:24:08,2025-10-06,05:24:08,5,LASNOC,0.667,28.379,52.26,0,0.263867,EPTFUS,LASCIN,NA,NA,21,21,4.846,1,0,45.863,28.048,8.318667,245AAA0666BC1507,Schmeeckle 2025 Master.csv,LPE\10 09\20251006,245AAA0666BC1507_20251006_102408T.WAV,245AAA0666BC1507_20251006_102408_000T.wav,NA,C:\Users\Nancy\Desktop\Bat Files,C:\Users\Nancy\Desktop\AutoID\10 09 Output,14,32.483,130.378,29.643,3.391,461,4.68,2.67,NA,2025-10-06T10:24:08Z
LPE,10/06/2025 05:24:36,2025-10-06,05:24:36,5,LASNOC,0.471,26.894,57.7,0,0.374105,LASCIN,EPTFUS,NA,NA,17,17,5.415,1,0,44.37,26.638,9,245AAA0666BC1507,Schmeeckle 2025 Master.csv,LPE\10 09\20251006,245AAA0666BC1507_20251006_102436T.WAV,245AAA0666BC1507_20251006_102436_000T.wav,NA,C:\Users\Nancy\Desktop\Bat Files,C:\Users\Nancy\Desktop\AutoID\10 09 Output,8,31.093,217.779,28.703,3.357,364.93,5.115,3.55,NA,2025-10-06T10:24:36Z
LPE,10/06/2025 05:25:04,2025-10-06,05:25:04,5,LASNOC,0.667,28.288,28.81,0,0.314441,EPTFUS,LASCIN,NA,NA,9,9,5.543,1,0,40.967,27.912,7.210667,245AAA0666BC1507,Schmeeckle 2025 Master.csv,LPE\10 09\20251006,245AAA0666BC1507_20251006_102504T.WAV,245AAA0666BC1507_20251006_102504_000T.wav,NA,C:\Users\Nancy\Desktop\Bat Files,C:\Users\Nancy\Desktop\AutoID\10 09 Output,6,31.267,174.566,29.22,3.529,325.65,5.08,1.28,NA,2025-10-06T10:25:04Z
LPE,10/06/2025 05:29:03,2025-10-06,05:29:03,5,LASNOC,1,27.638,23.52,0,0.36965,LASCIN,EPTFUS,NA,NA,4,4,5.098,1,0,30.415,27.168,2.369333,245AAA0666BC1507,Schmeeckle 2025 Master.csv,LPE\10 09\20251006,245AAA0666BC1507_20251006_102903T.WAV,245AAA0666BC1507_20251006_102903_000T.wav,NA,C:\Users\Nancy\Desktop\Bat Files,C:\Users\Nancy\Desktop\AutoID\10 09 Output,4,28.137,581.275,27.978,2.994,39.69,3.679,0.88,NA,2025-10-06T10:29:03Z
LPE,10/06/2025 05:29:44,2025-10-06,05:29:44,5,LASNOC,0.481,27.574,38.7,0,0.468291,EPTFUS,LASCIN,NA,NA,27,27,5.248,1,0,39.092,27.09,8.318667,245AAA0666BC1507,Schmeeckle 2025 Master.csv,LPE\10 09\20251006,245AAA0666BC1507_20251006_102944T.WAV,245AAA0666BC1507_20251006_102944_000T.wav,NA,C:\Users\Nancy\Desktop\Bat Files,C:\Users\Nancy\Desktop\AutoID\10 09 Output,13,30.102,159.558,29.02,2.849,382.89,4.735,3.9,NA,2025-10-06T10:29:44Z
LPE,10/06/2025 05:32:04,2025-10-06,05:32:04,5,LASNOC,0.904,27.712,93.76,0,0.25766,EPTFUS,LASCIN,NA,NA,52,52,3.87,1,0,45.145,27.303,8.916,245AAA0666BC1507,Schmeeckle 2025 Master.csv,LPE\10 09\20251006,245AAA0666BC1507_20251006_103204T.WAV,245AAA0666BC1507_20251006_103204_000T.wav,NA,C:\Users\Nancy\Desktop\Bat Files,C:\Users\Nancy\Desktop\AutoID\10 09 Output,47,32.132,142.796,29.89,2.529,510.31,3.715,10.2,NA,2025-10-06T10:32:04Z
LPE,10/06/2025 05:32:32,2025-10-06,05:32:32,5,LASNOC,0.6,27.388,45.17,0,0.307281,EPTFUS,LASCIN,NA,NA,55,55,4.824,1,0,39.643,26.906,9,245AAA0666BC1507,Schmeeckle 2025 Master.csv,LPE\10 09\20251006,245AAA0666BC1507_20251006_103232T.WAV,245AAA0666BC1507_20251006_103232_000T.wav,NA,C:\Users\Nancy\Desktop\Bat Files,C:\Users\Nancy\Desktop\AutoID\10 09 Output,33,30.168,124.808,28.751,2.882,417.72,4.387,8.82,NA,2025-10-06T10:32:32Z
LPE,10/06/2025 05:35:06,2025-10-06,05:35:06,5,LASNOC,0.5,26.888,5.5,0,0.380059,EPTFUS,LASCIN,NA,NA,2,2,5.024,1,0,29.924,26.317,3.285333,245AAA0666BC1507,Schmeeckle 2025 Master.csv,LPE\10 09\20251006,245AAA0666BC1507_20251006_103506T.WAV,245AAA0666BC1507_20251006_103506_000T.wav,NA,C:\Users\Nancy\Desktop\Bat Files,C:\Users\Nancy\Desktop\AutoID\10 09 Output,1,27.173,1038.347,26.949,3.128,236.7,3.724,0.42,NA,2025-10-06T10:35:06Z
LPE,10/06/2025 05:41:24,2025-10-06,05:41:24,5,LASNOC,0.812,26.918,28.51,0,0.449438,EPTFUS,LASCIN,NA,NA,16,16,6.344,1,0,44.356,26.651,7.38,245AAA0666BC1507,Schmeeckle 2025 Master.csv,LPE\10 09\20251006,245AAA0666BC1507_20251006_104124T.WAV,245AAA0666BC1507_20251006_104124_000T.wav,NA,C:\Users\Nancy\Desktop\Bat Files,C:\Users\Nancy\Desktop\AutoID\10 09 Output,13,30.724,212.016,27.977,4.331,467.51,6.055,2.63,NA,2025-10-06T10:41:24Z
LPE,10/06/2025 05:43:30,2025-10-06,05:43:30,5,LASNOC,0.688,27.753,65.65,0,0.401744,EPTFUS,LASCIN,NA,NA,16,16,3.86,1,0,42.822,27.572,6.014667,245AAA0666BC1507,Schmeeckle 2025 Master.csv,LPE\10 09\20251006,245AAA0666BC1507_20251006_104330T.WAV,245AAA0666BC1507_20251006_104330_000T.wav,NA,C:\Users\Nancy\Desktop\Bat Files,C:\Users\Nancy\Desktop\AutoID\10 09 Output,11,31.708,161.082,29.48,2.283,372.73,3.734,2.68,NA,2025-10-06T10:43:30Z
LPE,10/06/2025 05:54:42,2025-10-06,05:54:42,5,LASNOC,0.371,25.871,68.62,0,0.283614,LASCIN,EPTFUS,NA,NA,35,35,4.947,1,0,39.427,25.554,7.124,245AAA0666BC1507,Schmeeckle 2025 Master.csv,LPE\10 09\20251006,245AAA0666BC1507_20251006_105442T.WAV,245AAA0666BC1507_20251006_105442_000T.wav,NA,C:\Users\Nancy\Desktop\Bat Files,C:\Users\Nancy\Desktop\AutoID\10 09 Output,13,29.051,135.891,27.587,3.136,448.52,4.615,4.83,NA,2025-10-06T10:54:42Z
LPE,10/06/2025 05:59:50,2025-10-06,05:59:50,5,LASBOR,0.5,43.754,35.52,0,0.175883,MYOLUC,PERSUB,NA,NA,4,4,3.929,1,0,53.839,43.591,7.381333,245AAA0666BC1507,Schmeeckle 2025 Master.csv,LPE\10 09\20251006,245AAA0666BC1507_20251006_105950T.WAV,245AAA0666BC1507_20251006_105950_000T.wav,NA,C:\Users\Nancy\Desktop\Bat Files,C:\Users\Nancy\Desktop\AutoID\10 09 Output,2,46.56,382.487,45.212,2.256,260,3.686,1.18,NA,2025-10-06T10:59:50Z
LPE,10/06/2025 06:00:04,2025-10-06,06:00:04,6,MYOLUC,0.818,51.274,96.27,0,0.162473,NA,NA,NA,NA,22,22,3.22,1,0,77.028,50.446,8.746667,245AAA0666BC1507,Schmeeckle 2025 Master.csv,LPE\10 09\20251006,245AAA0666BC1507_20251006_110004T.WAV,245AAA0666BC1507_20251006_110004_000T.wav,NA,C:\Users\Nancy\Desktop\Bat Files,C:\Users\Nancy\Desktop\AutoID\10 09 Output,18,57.93,196.53,56.078,1.614,502.5,3.042,4.49,NA,2025-10-06T11:00:04Z
LPE,10/06/2025 06:04:16,2025-10-06,06:04:16,6,LASNOC,0.385,26.591,110.64,0,0.374097,LASCIN,EPTFUS,NA,NA,13,13,3.354,1,0,43.102,26.53,8.404,245AAA0666BC1507,Schmeeckle 2025 Master.csv,LPE\10 09\20251006,245AAA0666BC1507_20251006_110416T.WAV,245AAA0666BC1507_20251006_110416_000T.wav,NA,C:\Users\Nancy\Desktop\Bat Files,C:\Users\Nancy\Desktop\AutoID\10 09 Output,5,30.918,146.253,29.512,1.946,600.77,3.33,2.42,NA,2025-10-06T11:04:16Z
LPE,10/06/2025 06:14:18,2025-10-06,06:14:18,6,LASNOC,0.8,27.127,25.45,0,0.452833,EPTFUS,LASCIN,NA,NA,5,5,5.934,1,0,35.705,26.947,2.430667,245AAA0666BC1507,Schmeeckle 2025 Master.csv,LPE\10 09\20251006,245AAA0666BC1507_20251006_111418T.WAV,245AAA0666BC1507_20251006_111418_000T.wav,NA,C:\Users\Nancy\Desktop\Bat Files,C:\Users\Nancy\Desktop\AutoID\10 09 Output,4,29.239,276.575,27.916,3.856,221.2,5.549,1.03,NA,2025-10-06T11:14:18Z
LPE,10/06/2025 06:14:32,2025-10-06,06:14:32,6,LASNOC,0.846,28.388,66.56,0,0.385507,EPTFUS,LASCIN,NA,NA,26,26,4.106,1,0,42.775,28.116,8.746667,245AAA0666BC1507,Schmeeckle 2025 Master.csv,LPE\10 09\20251006,245AAA0666BC1507_20251006_111432T.WAV,245AAA0666BC1507_20251006_111432_000T.wav,NA,C:\Users\Nancy\Desktop\Bat Files,C:\Users\Nancy\Desktop\AutoID\10 09 Output,22,31.948,277.408,30.314,2.523,520.17,3.908,4.21,NA,2025-10-06T11:14:32Z
LPE,10/06/2025 06:15:14,2025-10-06,06:15:14,6,LASNOC,0.429,27.735,92.38,0,0.291832,EPTFUS,NA,NA,NA,14,14,3.478,1,0,39.361,27.315,4.478667,245AAA0666BC1507,Schmeeckle 2025 Master.csv,LPE\10 09\20251006,245AAA0666BC1507_20251006_111514T.WAV,245AAA0666BC1507_20251006_111514_000T.wav,NA,C:\Users\Nancy\Desktop\Bat Files,C:\Users\Nancy\Desktop\AutoID\10 09 Output,6,31.061,116.414,30.64,1.815,392.09,3.279,2.51,NA,2025-10-06T11:15:14Z
LPE,10/06/2025 18:57:38,2025-10-06,18:57:38,18,LASNOC,0.381,26.729,29.47,0,0.291114,EPTFUS,LASCIN,NA,NA,21,21,5.921,1,0,35.949,26.475,9,245AAA0666BC1507,Schmeeckle 2025 Master.csv,LPE\10 09\20251006,245AAA0666BC1507_20251006_235738T.WAV,245AAA0666BC1507_20251006_235738_000T.wav,NA,C:\Users\Nancy\Desktop\Bat Files,C:\Users\Nancy\Desktop\AutoID\10 09 Output,8,28.828,158.865,27.53,3.911,305.86,5.436,3.38,NA,2025-10-06T23:57:38Z
LPE,10/06/2025 19:11:24,2025-10-06,19:11:24,19,LASCIN,1,20.734,-0.51,0,0.405543,NA,NA,NA,NA,12,12,3.578,1,0,21.206,20.475,9,245AAA0666BC1507,Schmeeckle 2025 Master.csv,LPE\10 09\20251007,245AAA0666BC1507_20251007_001124T.WAV,245AAA0666BC1507_20251007_001124_000T.wav,NA,C:\Users\Nancy\Desktop\Bat Files,C:\Users\Nancy\Desktop\AutoID\10 09 Output,12,20.739,610.95,20.741,1.548,61.09,2.686,2.67,NA,2025-10-07T00:11:24Z
LPE,10/06/2025 20:48:28,2025-10-06,20:48:28,20,LASNOC,1,28.348,10.71,0,0.524261,EPTFUS,LASCIN,NA,NA,3,3,6.178,1,0,37.751,27.477,4.138667,245AAA0666BC1507,Schmeeckle 2025 Master.csv,LPE\10 09\20251007,245AAA0666BC1507_20251007_014828T.WAV,245AAA0666BC1507_20251007_014828_000T.wav,NA,C:\Users\Nancy\Desktop\Bat Files,C:\Users\Nancy\Desktop\AutoID\10 09 Output,3,30.059,267.712,28.625,3.941,327.92,4.925,0.74,NA,2025-10-07T01:48:28Z
LPE,10/06/2025 20:51:02,2025-10-06,20:51:02,20,LASNOC,1,27.773,19.16,0,0.375684,EPTFUS,LASCIN,NA,NA,6,6,3.778,1,0,30.598,27.472,9,245AAA0666BC1507,Schmeeckle 2025 Master.csv,LPE\10 09\20251007,245AAA0666BC1507_20251007_015102T.WAV,245AAA0666BC1507_20251007_015102_000T.wav,NA,C:\Users\Nancy\Desktop\Bat Files,C:\Users\Nancy\Desktop\AutoID\10 09 Output,6,28.331,434.865,28.127,2.041,153.09,3.145,1.56,NA,2025-10-07T01:51:02Z
LPE,10/06/2025 20:51:16,2025-10-06,20:51:16,20,LASNOC,0.4,27.899,56.03,0,0.296909,EPTFUS,LASCIN,NA,NA,40,40,4.538,1,0,40.806,27.158,9,245AAA0666BC1507,Schmeeckle 2025 Master.csv,LPE\10 09\20251007,245AAA0666BC1507_20251007_015116T.WAV,245AAA0666BC1507_20251007_015116_000T.wav,NA,C:\Users\Nancy\Desktop\Bat Files,C:\Users\Nancy\Desktop\AutoID\10 09 Output,16,30.779,158.034,29.556,2.559,400.65,4.134,7.67,NA,2025-10-07T01:51:16Z
LPE,10/06/2025 20:51:58,2025-10-06,20:51:58,20,EPTFUS,0.5,29.359,32.86,0,0.331439,LASNOC,NA,NA,NA,2,2,3.906,1,0,37.972,29.041,9,245AAA0666BC1507,Schmeeckle 2025 Master.csv,LPE\10 09\20251007,245AAA0666BC1507_20251007_015158T.WAV,245AAA0666BC1507_20251007_015158_000T.wav,NA,C:\Users\Nancy\Desktop\Bat Files,C:\Users\Nancy\Desktop\AutoID\10 09 Output,1,31.659,117.406,30.191,2.553,269.53,3.767,0.47,NA,2025-10-07T01:51:58Z
LPE,10/06/2025 20:52:12,2025-10-06,20:52:12,20,LASNOC,0.739,28.902,27.81,0,0.272894,EPTFUS,LASCIN,NA,NA,23,23,4.96,1,0,42.779,28.623,9,245AAA0666BC1507,Schmeeckle 2025 Master.csv,LPE\10 09\20251007,245AAA0666BC1507_20251007_015212T.WAV,245AAA0666BC1507_20251007_015212_000T.wav,NA,C:\Users\Nancy\Desktop\Bat Files,C:\Users\Nancy\Desktop\AutoID\10 09 Output,17,32.047,146.161,29.668,3.391,407.86,4.789,4.28,NA,2025-10-07T01:52:12Z
LPE,10/06/2025 20:52:54,2025-10-06,20:52:54,20,LASNOC,0.556,28.049,22.49,0,0.285675,EPTFUS,LASCIN,NA,NA,18,18,4.544,1,0,35.287,27.902,9,245AAA0666BC1507,Schmeeckle 2025 Master.csv,LPE\10 09\20251007,245AAA0666BC1507_20251007_015254T.WAV,245AAA0666BC1507_20251007_015254_000T.wav,NA,C:\Users\Nancy\Desktop\Bat Files,C:\Users\Nancy\Desktop\AutoID\10 09 Output,10,29.864,301.891,28.819,2.778,191.55,4.351,3.62,NA,2025-10-07T01:52:54Z
LPE,10/06/2025 20:53:08,2025-10-06,20:53:08,20,EPTFUS,1,29.471,35.28,0,0.33495,LASNOC,LASBOR,NA,NA,2,2,2.789,1,0,33.219,29.471,9,245AAA0666BC1507,Schmeeckle 2025 Master.csv,LPE\10 09\20251007,245AAA0666BC1507_20251007_015308T.WAV,245AAA0666BC1507_20251007_015308_000T.wav,NA,C:\Users\Nancy\Desktop\Bat Files,C:\Users\Nancy\Desktop\AutoID\10 09 Output,2,30.794,244.528,30.37,1.583,90.52,2.721,0.69,NA,2025-10-07T01:53:08Z
LPE,10/06/2025 20:53:36,2025-10-06,20:53:36,20,LASNOC,0.721,27.512,24.49,0,0.342294,EPTFUS,LASCIN,NA,NA,43,43,6.104,1,0,37.651,27.273,9,245AAA0666BC1507,Schmeeckle 2025 Master.csv,LPE\10 09\20251007,245AAA0666BC1507_20251007_015336T.WAV,245AAA0666BC1507_20251007_015336_000T.wav,NA,C:\Users\Nancy\Desktop\Bat Files,C:\Users\Nancy\Desktop\AutoID\10 09 Output,31,29.821,148.812,28.343,3.804,300.29,5.657,6.4,NA,2025-10-07T01:53:36Z
LPE,10/06/2025 20:54:18,2025-10-06,20:54:18,20,LASNOC,0.68,27.734,22.71,0,0.285251,EPTFUS,LASCIN,NA,NA,25,25,5.738,1,0,37.173,27.453,9,245AAA0666BC1507,Schmeeckle 2025 Master.csv,LPE\10 09\20251007,245AAA0666BC1507_20251007_015418T.WAV,245AAA0666BC1507_20251007_015418_000T.wav,NA,C:\Users\Nancy\Desktop\Bat Files,C:\Users\Nancy\Desktop\AutoID\10 09 Output,17,29.941,186.551,28.424,3.816,325.96,5.239,4.58,NA,2025-10-07T01:54:18Z
LPE,10/06/2025 20:55:14,2025-10-06,20:55:14,20,LASNOC,0.688,27.534,19.44,0,0.358419,EPTFUS,LASCIN,NA,NA,16,16,5.723,1,0,31.395,27.184,9,245AAA0666BC1507,Schmeeckle 2025 Master.csv,LPE\10 09\20251007,245AAA0666BC1507_20251007_015514T.WAV,245AAA0666BC1507_20251007_015514_000T.wav,NA,C:\Users\Nancy\Desktop\Bat Files,C:\Users\Nancy\Desktop\AutoID\10 09 Output,11,28.424,294.215,28.007,3.6,174.37,4.925,2.49,NA,2025-10-07T01:55:14Z
LPE,10/06/2025 20:55:42,2025-10-06,20:55:42,20,LASNOC,0.56,28.02,20.88,0,0.275337,EPTFUS,LASCIN,NA,NA,25,25,4.899,1,0,35.721,27.586,9,245AAA0666BC1507,Schmeeckle 2025 Master.csv,LPE\10 09\20251007,245AAA0666BC1507_20251007_015542T.WAV,245AAA0666BC1507_20251007_015542_000T.wav,NA,C:\Users\Nancy\Desktop\Bat Files,C:\Users\Nancy\Desktop\AutoID\10 09 Output,14,29.728,252.666,28.535,3.315,234.14,4.346,7.48,NA,2025-10-07T01:55:42Z
LPE,10/06/2025 20:56:10,2025-10-06,20:56:10,20,LASNOC,0.889,26.715,12.33,0,0.474678,EPTFUS,LASCIN,NA,NA,9,9,7.69,1,0,34.13,26.274,9,245AAA0666BC1507,Schmeeckle 2025 Master.csv,LPE\10 09\20251007,245AAA0666BC1507_20251007_015610T.WAV,245AAA0666BC1507_20251007_015610_000T.wav,NA,C:\Users\Nancy\Desktop\Bat Files,C:\Users\Nancy\Desktop\AutoID\10 09 Output,8,28.051,262.595,27.086,5.076,282.89,6.629,1.93,NA,2025-10-07T01:56:10Z
LPE,10/06/2025 21:00:11,2025-10-06,21:00:11,21,LASNOC,0.75,25.594,6.75,0,0.351499,LASCIN,EPTFUS,NA,NA,4,4,8.005,1,0,27.949,25.269,4.637333,245AAA0666BC1507,Schmeeckle 2025 Master.csv,LPE\10 09\20251007,245AAA0666BC1507_20251007_020011T.WAV,245AAA0666BC1507_20251007_020011_000T.wav,NA,C:\Users\Nancy\Desktop\Bat Files,C:\Users\Nancy\Desktop\AutoID\10 09 Output,3,26.276,662.337,25.883,5.566,43.23,7.605,1.24,NA,2025-10-07T02:00:11Z
LPE,10/06/2025 21:01:04,2025-10-06,21:01:04,21,LASNOC,0.741,27.206,12.5,0,0.341411,EPTFUS,LASCIN,NA,NA,27,27,6.151,1,0,33.958,26.835,7.806667,245AAA0666BC1507,Schmeeckle 2025 Master.csv,LPE\10 09\20251007,245AAA0666BC1507_20251007_020104T.WAV,245AAA0666BC1507_20251007_020104_000T.wav,NA,C:\Users\Nancy\Desktop\Bat Files,C:\Users\Nancy\Desktop\AutoID\10 09 Output,20,28.676,278.48,27.653,4.269,168.39,5.621,4.82,NA,2025-10-07T02:01:04Z
LPE,10/06/2025 21:05:16,2025-10-06,21:05:16,21,LASNOC,1,26.73,7.49,0,0.38958,LASCIN,EPTFUS,NA,NA,8,8,6.119,1,0,27.928,26.446,5.162667,245AAA0666BC1507,Schmeeckle 2025 Master.csv,LPE\10 09\20251007,245AAA0666BC1507_20251007_020516T.WAV,245AAA0666BC1507_20251007_020516_000T.wav,NA,C:\Users\Nancy\Desktop\Bat Files,C:\Users\Nancy\Desktop\AutoID\10 09 Output,8,27.049,353.053,27.123,2.347,45.81,5.141,1.91,NA,2025-10-07T02:05:16Z
LPE,10/06/2025 21:29:46,2025-10-06,21:29:46,21,LASNOC,0.9,25.53,6.48,0,0.307504,LASCIN,EPTFUS,NA,NA,10,10,4.579,1,0,26.756,24.966,9,245AAA0666BC1507,Schmeeckle 2025 Master.csv,LPE\10 09\20251007,245AAA0666BC1507_20251007_022946T.WAV,245AAA0666BC1507_20251007_022946_000T.wav,NA,C:\Users\Nancy\Desktop\Bat Files,C:\Users\Nancy\Desktop\AutoID\10 09 Output,9,25.762,379.604,25.673,2.046,73.29,3.588,2.15,NA,2025-10-07T02:29:46Z
LPE,10/06/2025 21:47:30,2025-10-06,21:47:30,21,LASNOC,1,26.305,12.97,0,0.468811,LASCIN,EPTFUS,NA,NA,4,4,5.782,1,0,28.711,25.907,9,245AAA0666BC1507,Schmeeckle 2025 Master.csv,LPE\10 09\20251007,245AAA0666BC1507_20251007_024730T.WAV,245AAA0666BC1507_20251007_024730_000T.wav,NA,C:\Users\Nancy\Desktop\Bat Files,C:\Users\Nancy\Desktop\AutoID\10 09 Output,4,26.856,1737.387,26.769,2.431,130.44,4.626,1.33,NA,2025-10-07T02:47:30Z
LPE,10/06/2025 21:48:12,2025-10-06,21:48:12,21,LASNOC,1,26.818,5.67,0,0.388827,LASCIN,EPTFUS,NA,NA,2,2,4.882,1,0,27.635,26.381,8.062667,245AAA0666BC1507,Schmeeckle 2025 Master.csv,LPE\10 09\20251007,245AAA0666BC1507_20251007_024812T.WAV,245AAA0666BC1507_20251007_024812_000T.wav,NA,C:\Users\Nancy\Desktop\Bat Files,C:\Users\Nancy\Desktop\AutoID\10 09 Output,2,26.928,556.639,26.991,2.095,-48.01,3.661,0.4,NA,2025-10-07T02:48:12Z
LPE,10/06/2025 21:57:18,2025-10-06,21:57:18,21,LASNOC,1,26.02,9.88,0,0.314658,LASCIN,EPTFUS,NA,NA,2,2,4.671,1,0,26.405,25.849,7.806667,245AAA0666BC1507,Schmeeckle 2025 Master.csv,LPE\10 09\20251007,245AAA0666BC1507_20251007_025718T.WAV,245AAA0666BC1507_20251007_025718_000T.wav,NA,C:\Users\Nancy\Desktop\Bat Files,C:\Users\Nancy\Desktop\AutoID\10 09 Output,2,26.107,866.681,26.231,2.601,38.04,3.904,0.63,NA,2025-10-07T02:57:18Z
LPE,10/06/2025 22:00:48,2025-10-06,22:00:48,22,LASNOC,0.739,25.486,0.97,0,0.175588,LASCIN,EPTFUS,NA,NA,23,23,6.39,1,0,26.066,25.152,9,245AAA0666BC1507,Schmeeckle 2025 Master.csv,LPE\10 09\20251007,245AAA0666BC1507_20251007_030048T.WAV,245AAA0666BC1507_20251007_030048_000T.wav,NA,C:\Users\Nancy\Desktop\Bat Files,C:\Users\Nancy\Desktop\AutoID\10 09 Output,17,25.382,294.492,25.555,2.329,33.8,4.206,5.61,NA,2025-10-07T03:00:48Z
LPE,10/06/2025 22:01:58,2025-10-06,22:01:58,22,LASNOC,1,24.747,36.54,0,0.35386,EPTFUS,LASCIN,NA,NA,3,3,3.848,1,0,25.372,24.619,8.830667,245AAA0666BC1507,Schmeeckle 2025 Master.csv,LPE\10 09\20251007,245AAA0666BC1507_20251007_030158T.WAV,245AAA0666BC1507_20251007_030158_000T.wav,NA,C:\Users\Nancy\Desktop\Bat Files,C:\Users\Nancy\Desktop\AutoID\10 09 Output,3,24.959,227.66,25.109,1.171,-68.53,3.154,0.9,NA,2025-10-07T03:01:58Z
LPE,10/06/2025 22:08:58,2025-10-06,22:08:58,22,LASNOC,1,27.001,-5.62,0,0.40415,LASCIN,EPTFUS,NA,NA,12,12,6.385,1,0,27.66,26.621,8.574667,245AAA0666BC1507,Schmeeckle 2025 Master.csv,LPE\10 09\20251007,245AAA0666BC1507_20251007_030858T.WAV,245AAA0666BC1507_20251007_030858_000T.wav,NA,C:\Users\Nancy\Desktop\Bat Files,C:\Users\Nancy\Desktop\AutoID\10 09 Output,12,27.027,653.379,27.037,1.434,55.38,4.723,2.93,NA,2025-10-07T03:08:58Z
LPE,10/06/2025 22:16:12,2025-10-06,22:16:12,22,LASNOC,1,26.93,16.32,0,0.458123,EPTFUS,LASCIN,NA,NA,12,12,9.158,1,0,30,26.499,7.721333,245AAA0666BC1507,Schmeeckle 2025 Master.csv,LPE\10 09\20251007,245AAA0666BC1507_20251007_031612T.WAV,245AAA0666BC1507_20251007_031612_000T.wav,NA,C:\Users\Nancy\Desktop\Bat Files,C:\Users\Nancy\Desktop\AutoID\10 09 Output,12,27.523,237.161,27.508,5.073,198.58,7.347,1.67,NA,2025-10-07T03:16:12Z
LPE,10/06/2025 22:24:50,2025-10-06,22:24:50,22,LASBOR,1,42.904,55.2,0,0.359284,PERSUB,MYOLUC,NA,NA,2,2,3.016,1,0,52.992,42.339,5.076,245AAA0666BC1507,Schmeeckle 2025 Master.csv,LPE\10 09\20251007,245AAA0666BC1507_20251007_032450T.WAV,245AAA0666BC1507_20251007_032450_000T.wav,NA,C:\Users\Nancy\Desktop\Bat Files,C:\Users\Nancy\Desktop\AutoID\10 09 Output,2,45.719,134.298,45.038,1.65,296.21,2.737,0.4,NA,2025-10-07T03:24:50Z
LPE,10/06/2025 22:34:24,2025-10-06,22:34:24,22,LASNOC,1,26.012,-11.71,0,0.302128,LASCIN,EPTFUS,NA,NA,3,3,6.418,1,0,27.318,25.677,8.745333,245AAA0666BC1507,Schmeeckle 2025 Master.csv,LPE\10 09\20251007,245AAA0666BC1507_20251007_033424T.WAV,245AAA0666BC1507_20251007_033424_000T.wav,NA,C:\Users\Nancy\Desktop\Bat Files,C:\Users\Nancy\Desktop\AutoID\10 09 Output,3,26.363,445.962,26.281,3.927,9.33,5.238,0.94,NA,2025-10-07T03:34:24Z
LPE,10/06/2025 22:40:42,2025-10-06,22:40:42,22,LASNOC,1,26.335,3.32,0,0.407001,LASCIN,EPTFUS,NA,NA,5,5,6.263,1,0,27.086,26.081,7.552,245AAA0666BC1507,Schmeeckle 2025 Master.csv,LPE\10 09\20251007,245AAA0666BC1507_20251007_034042T.WAV,245AAA0666BC1507_20251007_034042_000T.wav,NA,C:\Users\Nancy\Desktop\Bat Files,C:\Users\Nancy\Desktop\AutoID\10 09 Output,5,26.472,377.186,26.463,3.283,57.63,5.497,0.72,NA,2025-10-07T03:40:42Z
LPE,10/06/2025 22:42:20,2025-10-06,22:42:20,22,LASNOC,1,28.407,32.42,0,0.375898,EPTFUS,NA,NA,NA,4,4,4.771,1,0,39.688,27.952,9,245AAA0666BC1507,Schmeeckle 2025 Master.csv,LPE\10 09\20251007,245AAA0666BC1507_20251007_034220T.WAV,245AAA0666BC1507_20251007_034220_000T.wav,NA,C:\Users\Nancy\Desktop\Bat Files,C:\Users\Nancy\Desktop\AutoID\10 09 Output,4,31.267,111.728,29.118,3.293,304.91,4.41,1.01,NA,2025-10-07T03:42:20Z
LPE,10/06/2025 22:43:30,2025-10-06,22:43:30,22,LASNOC,0.833,26.178,3.57,0,0.255889,LASCIN,EPTFUS,NA,NA,6,6,3.578,1,0,26.835,25.752,5.161333,245AAA0666BC1507,Schmeeckle 2025 Master.csv,LPE\10 09\20251007,245AAA0666BC1507_20251007_034330T.WAV,245AAA0666BC1507_20251007_034330_000T.wav,NA,C:\Users\Nancy\Desktop\Bat Files,C:\Users\Nancy\Desktop\AutoID\10 09 Output,5,26.292,474.866,26.264,1.339,62.84,2.232,1.29,NA,2025-10-07T03:43:30Z
LPE,10/06/2025 22:48:52,2025-10-06,22:48:52,22,LASNOC,0.545,24.728,1.65,0,0.243134,LASCIN,EPTFUS,NA,NA,11,11,6.515,1,0,25.505,24.532,9,245AAA0666BC1507,Schmeeckle 2025 Master.csv,LPE\10 09\20251007,245AAA0666BC1507_20251007_034852T.WAV,245AAA0666BC1507_20251007_034852_000T.wav,NA,C:\Users\Nancy\Desktop\Bat Files,C:\Users\Nancy\Desktop\AutoID\10 09 Output,6,24.895,312.535,24.829,2.582,37.8,5.019,2.15,NA,2025-10-07T03:48:52Z
LPE,10/06/2025 22:49:34,2025-10-06,22:49:34,22,LASCIN,1,18.548,12.34,0,0.502381,NA,NA,NA,NA,2,2,4.638,1,0,18.812,18.417,7.636,245AAA0666BC1507,Schmeeckle 2025 Master.csv,LPE\10 09\20251007,245AAA0666BC1507_20251007_034934T.WAV,245AAA0666BC1507_20251007_034934_000T.wav,NA,C:\Users\Nancy\Desktop\Bat Files,C:\Users\Nancy\Desktop\AutoID\10 09 Output,2,18.597,855.896,18.616,1.845,88.75,2.869,0.48,NA,2025-10-07T03:49:34Z
